"UID","name","matched_name","barcode","brand","category_1","category_2","category_3","category_4","rating","match_score"
"ID_499","Schwartz Ginger Ground 24G","Schwartz Ground Ginger 26G Jar","00000050191406","SCHWARTZ","Food Cupboard","Cooking Ingredients","Seasoning, Herbs & Spices","Spices","5.0","80.8"
"ID_500","Tesco Whole Black Peppercorn 50G","Tesco Whole Black Peppercorns 100G","00000003011416","TESCO","Food Cupboard","Cooking Ingredients","Salt & Pepper","Black Peppercorns & Pepper Grinder","4.6","96.6"
"ID_501","Blue Dragon Thai Red Curry Paste 285G","Blue Dragon Thai Red Curry Paste 170G","05010338301507","BLUE DRAGON","Food Cupboard","Cooking Sauces, Meal Kits & Sides","Curry Pastes","Thai Curry Pastes","4.3","98.7"
"ID_502","Tesco Tenderstem 80G","Tesco Trimmed Tenderstem Broccoli 80G","00000003283615","TESCO","Fresh Food","Fresh Vegetables & Fresh Flowers","Prepared Vegetables","Prepared Single Vegetables","3.2","57.1"
"ID_503","Garden Pride Gherkins In Sweet & Sour Vinegar 680G","Hearty Food Co. Sweet & Sour Sauce 440G","05057753158408","HEARTY FOOD CO.","Food Cupboard","Cooking Sauces, Meal Kits & Sides","Chinese","Sweet & Sour Sauce","3.7","58.4"
"ID_504","Kikkoman Teriyaki Sauce Sesame 250Ml","Kikkoman Teriyaki Sauce Sesame 250Ml","08715035280304","KIKKOMAN","Food Cupboard","Cooking Sauces, Meal Kits & Sides","Chinese","Stir Fry Sauce & Vegetables","5.0","100.0"
"ID_505","Vivera Veggie Greek Kebab 175G","Vivera Veggie Greek Kebab 175G","08718300876981","VIVERA","Fresh Food","Chilled Vegetarian & Vegan","Kebabs, Strips & Pieces","Vegan Kebabs & Koftas & Vegetarian Kebabs & Koftas","4.3","100.0"
"ID_506","Doritos Tortilla Chips Tangy Cheese Sharing Bag Crisps 180g","Doritos Tortilla Chips Tangy Cheese Sharing Bag Crisps 180g","05000328028651","DORITOS","Food Cupboard","Crisps, Snacks, Nuts & Popcorn","Sharing Crisps & Snacks","Sharing Party Snacks & Crisps","4.6","100.0"
"ID_507","Tesco Mozzarella 240G","Tesco 12 Mozzarella Sticks 240G","05057545864586","TESCO","Fresh Food","Pies, Pasties, Quiches & Snacking","Cocktail Sausages & Party Food","Party Food","4.0","92.5"
"ID_508","Tesco Closed Cup Mushrooms 300G","Tesco Closed Cup Mushrooms 400G","00000003478295","TESCO","Fresh Food","Fresh Vegetables & Fresh Flowers","Mushrooms","White & Button Mushrooms","3.0","98.2"
"ID_509","Tesco Finest Sun Dried Tomato Garlic & Basil Sauce 340G","Tesco Finest Sun Dried Tomato Garlic & Basil Sauce 340G","05000358326642","TESCO FINEST","Food Cupboard","Cooking Sauces, Meal Kits & Sides","Italian","Tomato Pasta Sauce & Meatball Sauce","3.8","100.0"
"ID_510","Tesco Large Garlic Each","Tesco Large Garlic","00261540000000","TESCO","Fresh Food","Fresh Vegetables & Fresh Flowers","Fresh Chillies, Herbs, Garlic & Ginger","Garlic Cloves","2.4","95.6"
"ID_511","Tesco Garlic Flatbread 255G","Tesco Garlic Flatbread 255G","05054269361995","TESCO","Fresh Food","Fresh Pizza, Pasta & Garlic Bread","Chilled Garlic Bread & Dough Balls","Garlic & Flavoured Flatbreads","2.8","100.0"
"ID_512","The Tofoo Co Naked Tofu 280G","The Tofoo Co Naked Tofu 280G","05034467000216","THE TOFOO CO","Fresh Food","Chilled Vegetarian & Vegan","Tofu & Tempeh","Tofu & Tempeh","4.8","100.0"
"ID_513","Blue Dragon Whole Wheat Noodles 300G","Blue Dragon Wholewheat Noodles 250g","05010338103781","BLUE DRAGON","Food Cupboard","Dried Pasta, Rice, Noodles & Cous Cous","Noodles","Wholewheat & Vegan Noodles","3.6","88.0"
"ID_514","Sharwoods Real Oyster Sauce 150Ml","Sharwoods Real Oyster Sauce 150Ml","05000197577816","SHARWOODS","Food Cupboard","Cooking Sauces, Meal Kits & Sides","Chinese","Stir Fry Sauce & Vegetables","4.0","100.0"
"ID_515","Very Lazy Red Chillies 190G","Very Lazy Red Chillies 190G","05012818160178","EPC","Food Cupboard","Cooking Ingredients","Seasoning, Herbs & Spices","Herb, Spice & Ginger Paste","3.7","100.0"
"ID_516","Yo! Salmon Deluxe 206G","Yo! Rainbow Salmon Poke 283G","05035272937469","YO!","Fresh Food","Chilled Soup, Sandwiches & Salad Pots","Lunch Meal Deals","£5.50 Meal Deal Mains","4.0","77.6"
"ID_517","Fanta Orange 500 M","Fanta Orange 500 M","00000040822938","FANTA","Drinks","On The Go Drinks","Fizzy & Soft Drinks","Fizzy & Soft Drinks","4.8","100.0"
"ID_518","Coca-Cola Original Taste 250ml","Coca-Cola Original Taste 150ml","00000054491014","Coca-Cola","Drinks","Fizzy & Soft Drinks","Cola","Regular Cola","5.0","98.3"
"ID_519","Guinness Draught 4X440ml","Guinness Draught 4X440ml","00000050213085","GUINNESS","Drinks","Beer & Cider","Stout & Porter","Traditional Stout & Porter","4.9","100.0"
"ID_520","Crabbies Alcoholic Ginger Beer 500Ml","Crabbies Alcoholic Ginger Beer 500Ml","05011166018896","CRABBIES","Drinks","Beer & Cider","Cider","Alcoholic Ginger Beer","4.4","100.0"
"ID_521","Tesco The Chicken Club Sandwich","Tesco The Chicken Club Sandwich","00000003275764","TESCO","Fresh Food","Chilled Soup, Sandwiches & Salad Pots","Sandwiches, Wraps & Sushi","Sandwiches","3.3","100.0"
"ID_522","John Smith's Extra Smooth Ale Can 4x440ml","John Smith's Extra Smooth 4X440Ml Cans","05035766641810","JOHN SMITHS","Drinks","Beer & Cider","Beer - Real Ale & Bitter","Beer - Bitter & Amber Ale","3.8","80.0"
"ID_523","Tesco Stonebaked Margherita Pizza 252G","Tesco Stonebaked Margherita Pizza 252G","05057967575824","TESCO","Fresh Food","Fresh Pizza, Pasta & Garlic Bread","Fresh Pizza","Stonebaked Pizza","2.6","98.0"
"ID_524","Linda Mccartney 2 Mozzarella Burgers 227G","Linda Mccartney 2 Mozzarella Burgers 227G","05014008002237","LINDA McCARTNEY'S","Frozen Food","Vegetarian","Vegetarian Sausages, Bacon & Burgers","Frozen Vegetarian Burgers","3.5","100.0"
"ID_525","Tesco Swede Each (C)","Tesco Swede","00000003315965","TESCO","Fresh Food","Fresh Vegetables & Fresh Flowers","Carrots & Root Vegetables","Swede & Turnips","1.7","89.6"
"ID_526","Tesco Butternut Squash Each (C)","Tesco Butternut Squash Each","00000003232545","TESCO VALUE","Fresh Food","Fresh Vegetables & Fresh Flowers","Courgettes, Aubergines & Squash","Butternut Squash","2.8","100.0"
"ID_527","Tesco Asparagus Bundle 250G (C)","Tesco Asparagus 180G","00000003321690","TESCO","Fresh Food","Fresh Vegetables & Fresh Flowers","Peas, Beans, Sweetcorn & Asparagus","Asparagus","2.1","89.0"
"ID_528","Tesco Skinless Boneless Scottish Mackerel In Brine 125G","Tesco Skinless Boneless Scottish Mackerel In Brine 125G","05018374363459","TESCO","Food Cupboard","Tins, Cans & Packets","Tinned Fish & Seafood","Tinned Mackerel","4.8","100.0"
"ID_529","Tesco Core Ripen At Home Nectarin 4 Pack (C)","Tesco Ripen At Home Nectarines Mineral 4 Pack","00000010012222","TESCO","Fresh Food","Fresh Fruit","Peaches, Nectarines, Plums & Apricots","Nectarines","4.0","90.8"
"ID_530","Wicked Kitchen California Inspired Christmas Wrap","Wicked Kitchen All Day Mexican Inspired Breakfast Wrap","05056684900124","WICKED KITCHEN","Fresh Food","Chilled Vegetarian & Vegan","Ready Meals","Vegan & Vegetarian Meal Kits","5.0","79.4"
"ID_531","Tesco Salmon, Prawn & Mackerel Sushi 224G","Tesco Mackerel, Salmon & Prawn Sushi 151g","05059697694288","TESCO","Fresh Food","Chilled Soup, Sandwiches & Salad Pots","Lunch Meal Deals","£5.50 Meal Deal Mains","3.0","95.9"
"ID_532","Tesco Finest New York Deli Inspired Pastrami & Emmental Sandwich","Tesco Finest New York Deli Inspired Pastrami & Emmental Sandwich","00000003281642","TESCO FINEST","Fresh Food","Chilled Soup, Sandwiches & Salad Pots","Lunch Meal Deals","£5.50 Meal Deal Mains","3.5","100.0"
"ID_533","Tesco Smoked Salmon Sushi Snack 57G","Tesco Smoked Salmon Sushi Snack 57G","05057753897697","TESCO","Fresh Food","Chilled Soup, Sandwiches & Salad Pots","Sandwiches, Wraps & Sushi","Sushi","3.5","100.0"
"ID_534","Tesco Halkidiki Olives & Slow Roasted Tomatoes 160G","Tesco Green Olives with Slow Roasted Tomatoes 150g","05063250532535","TESCO","Fresh Food","Cooked Meats, Antipasti & Dips","Olives, Antipasti & Tapas","Olives","","88.1"
"ID_535","Thai Dragon Sriracha Hot Chilli Sauce 455Ml","Thai Dragon Sriracha Hot Chilli Sauce 455Ml","05020580016999","THAI DRAGON","Food Cupboard","Table Sauces, Olives, Pickles & Chutney","Sweet Chilli & Hot Sauces","Hot Pepper Sauce","3.0","100.0"
"ID_536","Tesco Finest Coleslaw 300G","Tesco Finest Coleslaw 300g","00000003411100","TESCO FINEST","Fresh Food","Fresh Salad, Coleslaw & Sandwich Fillers","Coleslaw & Potato Salad","Premium Coleslaw","","100.0"
"ID_537","Tesco Finest Smoked Scottish Salmon & Cream Cheese Sandwich","Tesco Finest Smoked Scottish Salmon & Cream Cheese Sandwich","00000003052068","TESCO FINEST","Fresh Food","Chilled Soup, Sandwiches & Salad Pots","Lunch Meal Deals","£5.50 Meal Deal Mains","4.3","100.0"
"ID_538","Hp Top Down Brown Sauce 450G","HP Brown Sauce 450g","05000111046244","HP","Food Cupboard","Table Sauces, Olives, Pickles & Chutney","Brown Sauce","Brown Sauce","4.4","93.6"
"ID_539","Tesco Spanish Style Tortilla 500G","Tesco Spanish Style Tortilla 500G","05052319376135","TESCO","Fresh Food","Cooked Meats, Antipasti & Dips","Olives, Antipasti & Tapas","Antipasti & Tortilla","2.4","100.0"
"ID_540","Tesco Finest Edamame & Greens Salad 200G","Tesco Finest Peppery Rainbow Tomato Side Salad 245g","05059697701061","TESCO FINEST","Fresh Food","Fresh Salad, Coleslaw & Sandwich Fillers","Lettuce & Salad bags","Salad Bowls","3.5","77.0"
"ID_541","Cauldron Foods Falafel 200G","Cauldron Foods Falafel 200G","05013683305589","CAULDRON","Fresh Food","Cooked Meats, Antipasti & Dips","Olives, Antipasti & Tapas","Antipasti & Tortilla","3.8","100.0"
"ID_542","Schweppes Slimline Tonic Water 1L","Schweppes Slimline Tonic Water 1L","05449000133380","SCHWEPPES","Drinks","Adult Soft Drinks & Mixers","Tonic & Mixers","Tonic & Soda Water","4.5","100.0"
"ID_543","Fever Tree Rhubarb & Raspberry Tonic Water 500Ml","Fever Tree Rhubarb & Raspberry Tonic Water 500Ml","05060108453240","FEVER TREE","Drinks","Adult Soft Drinks & Mixers","Tonic & Mixers","Tonic & Soda Water","4.9","100.0"
"ID_544","Tesco Stackable Clips Pins And Bands","Tesco Paper Clips","05057545443880","TESCO HOMEOFFICE","Home & Ents","Stationery, Arts & Crafts","Home Office & Office Essentials","Drawing Pins, Rubber Bands & Paper Clips","","73.1"
"ID_545","T.Assorted Ballpoint Pens 10 Pack","T.Assorted Ballpoint Pens 10 Pack","04893855003724","TESCO HOMEOFFICE","Home & Ents","Stationery, Arts & Crafts","Pens & Pencils","Biro Pens & Ball Point Pens","2.5","100.0"
"ID_546","T.Whiteboard Markers Asstd 4 Pack","Tesco Whiteboard Markers Asstd 4 Pack Millimetre","05059944101026","TESCO HOMEOFFICE","Home & Ents","Stationery, Arts & Crafts","Markers & Highlighters","Whiteboard Pens & Chalk Pens","3.5","94.0"
"ID_547","Tesco Lever Arch Red And Purple","Tesco Lever Arch Assorted","05057967252350","TESCO HOMEOFFICE","Home & Ents","Stationery, Arts & Crafts","Back To School","Ring Binder & Lever Arch Files","5.0","94.5"
"ID_548","Tesco Mixed Leaf Salad 120G","Tesco Mixed Leaf Salad 120G","00000003267660","TESCO","Fresh Food","Fresh Salad, Coleslaw & Sandwich Fillers","Lettuce & Salad bags","Salad Bags","3.8","100.0"
"ID_549","Tesco Finest Moroccan Inspired Couscous 230G","Tesco Finest Moroccan Inspired Couscous 230g","00000003490242","TESCO FINEST","Fresh Food","Fresh Salad, Coleslaw & Sandwich Fillers","Salad Pots & Pasta Salad","Cous Cous Salad","3.0","100.0"
"ID_550","Quorn Vegan Smoky Ham Free Slice 100G","Quorn Vegan Smoky Ham Free Slice 100G","05019503034165","QUORN","Fresh Food","Chilled Vegetarian & Vegan","Deli Slices, Ready to Eat Pieces & Falafels","Vegan Slices & Pieces","3.5","100.0"
"ID_551","Hovis Original 7 Seeds Bread 800G","Hovis Seed Sensations Seven Seeds Sliced Bread 800g","05010003064744","HOVIS","Bakery","Bread & Rolls","Seeded Bread","Seeded Bread","4.2","91.8"
"ID_552","Popchips Bbq Flavour 5X17g","Popchips Bbq Flavour 5X17g","05000237134580","POPCHIPS","Food Cupboard","Crisps, Snacks, Nuts & Popcorn","Multipack Crisps & Snacks","Variety Multipack Crisps & Snacks","3.8","100.0"
"ID_553","Pizza Express Dough Balls 200G","Pizza Express Dough Balls 200G","05010217223838","PIZZA EXPRESS","Fresh Food","Fresh Pizza, Pasta & Garlic Bread","Chilled Garlic Bread & Dough Balls","Dough Balls","4.5","100.0"
"ID_554","Pizza Express Romana Pollo American Pizza 375G","Pizza Express American Pizza 250G","05024530005316","PIZZA EXPRESS","Fresh Food","Fresh Pizza, Pasta & Garlic Bread","Fresh Pizza","Tesco Finest & Premium Pizza","3.3","86.0"
"ID_555","La Gioiosa Prosecco Rose Millesimato 75Cl","La Gioiosa Prosecco Rose Millesimato 75Cl","08006805232020","LA GIOIOSA","Drinks","Wine","Prosecco, Champagne & Sparkling Wine","Prosecco","4.4","100.0"
"ID_556","Napolina Extra Virgin Olive Oil 500Ml +50% Extra","Napolina Extra Virgin Olive Oil 500Ml","05000232919953","NAPOLINA","Food Cupboard","Cooking Ingredients","Oils & Cooking Fats","Extra Virgin Olive Oil","4.2","96.6"
"ID_557","Tesco Kale 180G (C)","Tesco Mangetout 180g","00000003436271","TESCO","Fresh Food","Fresh Vegetables & Fresh Flowers","Peas, Beans, Sweetcorn & Asparagus","Peas","","83.7"
"ID_558","Tesco Free Range 6 Medium Express Pack","Tesco Free Range Eggs Medium 6 Pack","05018374888341","TESCO","Fresh Food","Milk, Butter & Eggs","Eggs","Free Range Eggs","2.8","76.0"
"ID_559","Tesco Rock Salt Grinder 100G","Tesco Rock Salt Grinder 100G","05054269552034","TESCO","Food Cupboard","Cooking Ingredients","Salt & Pepper","Rock Salt & Salt Grinder","2.1","100.0"
"ID_560","Frank's RedHot Original Cayenne Pepper Hot Sauce 148ml","Frank's RedHot Original Cayenne Pepper Hot Sauce 148ml","00041500888125","FRANKS","Food Cupboard","Table Sauces, Olives, Pickles & Chutney","Sweet Chilli & Hot Sauces","Hot Pepper Sauce","4.6","100.0"
"ID_561","Tesco 4 Vegetable Samosas 216G","Tesco Vegetable Samosas 4 Pack 216g","05057753928919","TESCO","Fresh Food","Ready Meals","Indian Ready Meals","Indian Ready Meal Starters & Sides","3.8","96.5"
"ID_562","Tesco The Triple Sandwich","Tesco The Triple Sandwich","00000003275757","TESCO","Fresh Food","Chilled Soup, Sandwiches & Salad Pots","Sandwiches, Wraps & Sushi","Sandwiches","2.8","97.3"
"ID_563","Tesco Fire Pit Habenero Relish 300G","Tesco Fire Pit Habanero Relish 310G","05059697737572","FIRE PIT","Food Cupboard","Table Sauces, Olives, Pickles & Chutney","Chutneys, Relishes & Pickles","Relish","2.4","82.6"
"ID_564","Tesco A4 Refill Pad 300 Pages","Tesco A4 Refill Pad 300 pages ","05063445535556","TESCO HOMEOFFICE","Home & Ents","Stationery, Arts & Crafts","Notebooks & Diaries","Refill Pads","","100.0"
"ID_565","Tesco Egg & Cress Sandwich","Tesco Egg & Cress Sandwich","00000050436705","TESCO","Fresh Food","Chilled Soup, Sandwiches & Salad Pots","Sandwiches, Wraps & Sushi","Sandwiches","3.6","100.0"
"ID_566","Oasis Citrus Punch 500ml","Oasis Citrus Punch 500ml","05449000125019","OASIS","Drinks","On The Go Drinks","Fizzy & Soft Drinks","Fizzy & Soft Drinks","","100.0"
"ID_567","Corona Extra 4X330ml","Corona Extra 4X330ml","07501064193101","CORONA","Drinks","Beer & Cider","Beer - Lager","Beer - Bottled Lager","3.2","100.0"
"ID_568","Tesco Bunched Spring Onions 100G","Tesco Bunched Spring Onions 100G","00000003242599","TESCO","Fresh Food","Fresh Salad, Coleslaw & Sandwich Fillers","Spring Onions, Radish & Beetroot","Spring Onions","2.5","100.0"
"ID_569","Tesco British Whole Milk 568Ml, 1 Pint","Tesco British Whole Milk 568Ml, 1 Pint","05031021057976","TESCO","Fresh Food","Milk, Butter & Eggs","Milk","Whole Milk","4.2","100.0"
"ID_570","Redmere Farms Garlic 4 Pack","Tesco Garlic 4 Pack","00000003316238","TESCO","Fresh Food","Fresh Vegetables & Fresh Flowers","Fresh Chillies, Herbs, Garlic & Ginger","Garlic Cloves","1.8","76.1"
"ID_571","Creamfields Mature White Cheddar 400G","Creamfields Mature White Cheddar 400G","05057967013869","CREAMFIELDS","Fresh Food","Cheese","Cheddar Cheese","Mature Cheddar Cheese","3.5","100.0"
"ID_572","Biona Organic Kimchi 350G","Biona Organic Kimchi 350G","05032722315334","BIONA","Food Cupboard","Table Sauces, Olives, Pickles & Chutney","Pickled Onions & Pickled Vegetables","Pickled Red Cabbage & Speciality Pickles","2.5","100.0"
"ID_573","Wicked Kitchen Chilli, Mint & Lime Salt 90G","Wicked Kitchen 6 Chorizo Style Bangers 350g","05056684900247","WICKED KITCHEN","Fresh Food","Chilled Vegetarian & Vegan","Sausages","Vegan Sausages & Vegetarian Sausages","3.2","66.7"
"ID_574","Bio-Tiful Dairy Kefir Drink Original 500Ml","Biotiful Gut Health Kefir Drink Original 500ml","05060337220415","BIO-TIFUL DAIRY LTD","Fresh Food","Yogurts","Kefir","Kefir Drinks ","4.7","76.7"
"ID_575","Tesco British Pork Sliced Liver","Tesco British Sliced Pork Liver","00236390000000","TESCO","Fresh Food","Fresh Meat & Poultry","Fresh Pork & Gammon","Pork Liver","3.6","99.6"
"ID_576","Tesco Flax Seeds 150G","Tesco Flax Seeds 150G","00000003263983","TESCO","Fresh Food","Fresh Fruit","Dried Fruit, Nuts & Seeds","Nuts","4.7","100.0"
"ID_577","Tesco Garden Peas 500G","Tesco Garden Peas 500G","00000010039410","TESCO","Fresh Food","Fresh Vegetables & Fresh Flowers","Peas, Beans, Sweetcorn & Asparagus","Peas","3.0","95.3"
"ID_578","Tesco Raspberries 150G Plus 33% Ef (W)","Tesco Raspberries 150G","00000003257067","TESCO","Fresh Food","Fresh Fruit","Berries & Cherries","Raspberries","3.3","93.6"
"ID_579","Tesco British Semi Skimmed Milk 568 Ml, 1 Pint","Tesco British Semi Skimmed Milk 568 Ml, 1 Pint","05031021057952","TESCO","Fresh Food","Milk, Butter & Eggs","Milk","Semi-Skimmed Milk","4.4","100.0"
"ID_580","Tesco Blueberries 150G+33% Ex/Free","Tesco Blueberries 150G","00000003257005","TESCO","Fresh Food","Fresh Fruit","Berries & Cherries","Blueberries","3.8","91.1"
"ID_581","Grower's Harvest Orange Juice Smooth 1 Litre","Grower's Harvest Orange Juice Smooth 1 Litre","05057545828984","Grower's Harvest","Drinks","Juices, Smoothies & Wellness Drinks","Long Life Juice","Long Life Orange Juice","3.0","100.0"
"ID_582","Tesco Greengages 250G","Tesco Green Vegetable Selection 250g","05063250544668","TESCO","Fresh Food","Ready Meals","Starters & Sides","Ready Meal Vegetable Sides","","74.0"
"ID_583","Nutella Hazelnut Chocolate Spread 200G","Nutella Hazelnut Chocolate Spread 350G","00000080177173","NUTELLA","Food Cupboard","Jams, Sweet & Savoury Spreads","Chocolate & Sweet Spreads","Chocolate & Hazelnut Spreads","3.8","97.7"
"ID_584","Crayola Supertips 12 Pack","Crayola Supertips 12 Pack","05010065075092","CRAYOLA","Home & Ents","Stationery, Arts & Crafts","Colouring","Colouring Pens & Felt Tips","4.7","100.0"
"ID_585","Lyle's Golden Syrup Breakfast 340G","Lyle's Golden Syrup Breakfast 340G","05010115811205","LYLES","Food Cupboard","Jams, Sweet & Savoury Spreads","Honey & Syrups","Maple & Golden Syrup","4.2","100.0"
"ID_586","Tesco British Strawberries 454G","Tesco Strawberries 400G","00000003257340","TESCO","Fresh Food","Fresh Fruit","Berries & Cherries","Strawberries","2.7","91.6"
"ID_587","Dr.Oetker Madagascan Vanilla Extract 35Ml","Dr.Oetker Madagascan Vanilla Extract 35Ml","00000096081280","DR. OETKER","Food Cupboard","Home Baking & Sugar","Extracts, Flavourings & Food Colourings","Vanilla Extract & Vanilla Paste","2.2","100.0"
"ID_588","Tesco Dry London Gin 70Cl","Tesco London Dry Gin 70cl","05000436493501","TESCO","Drinks","Spirits","Gin","Classic & Dry Gin","3.9","99.2"
"ID_589","Schweppes Canada Dry Ginger Ale 1L","Schweppes Canada Dry Ginger Ale 1L","05449000133465","SCHWEPPES","Drinks","Adult Soft Drinks & Mixers","Tonic & Mixers","Ginger Beer & Ale","4.4","100.0"
"ID_590","Tesco Finest Prosecco Rose 75Cl","Tesco Finest Prosecco Rose 75Cl","05057753934514","TESCO FINEST","Drinks","Wine","Prosecco, Champagne & Sparkling Wine","Prosecco","4.7","100.0"
"ID_591","Tesco Feta Semi Dried Tomato Pasta 290G","Tesco Feta Semi Dried Tomato Pasta 290G","00000003236420","TESCO","Fresh Food","Chilled Soup, Sandwiches & Salad Pots","Pasta, Salad Pots & Noodle Pots","Pasta Salads","4.0","100.0"
"ID_592","Ribena Blackcurrant Light Bottle 500 M","Ribena Blackcurrant Juice Drink 500ml","05054267002333","RIBENA","Drinks","On The Go Drinks","Fizzy & Soft Drinks","Fizzy & Soft Drinks","4.4","72.7"
"ID_593","BODDINGTONS     DRAUGHT BITTER  4X440ML CANS    ","Boddingtons Draught Bitter Beer Cans 4 x 440ml","05010017060220","BODDINGTONS","Drinks","Beer & Cider","Beer - Real Ale & Bitter","Beer - Bitter & Amber Ale","4.0","89.5"
"ID_594","Get More Vitamin D 500 Ml","Get More Vitamin D Still Water Mango & Passionfruit Drink 500ml","05060338920017","GET MORE","Drinks","Water","Flavoured Still Water","Single Bottled Flavoured Still Water","4.9","68.2"
"ID_595","Cobra 660Ml","Cobra Beer 500ml Case of 24 x 500ml Cans","05010038462461","Cobra","Marketplace","Beers, Wines & Spirits","Beer","Beer - Lager","","65.1"
"ID_596","San Miguel Especial Lager Beer Bottle 660ml","San Miguel Especial Lager Beer Bottle 660ml","05010153773671","SAN MIGUEL","Drinks","Beer & Cider","Beer - Lager","Beer - Bottled Lager","4.5","100.0"
"ID_597","Kettle Lightly Salted Chips 50G","Kettle Lightly Salted Potato Chips 130G","05017764128104","KETTLE","Food Cupboard","Crisps, Snacks, Nuts & Popcorn","Sharing Crisps & Snacks","Sharing Party Snacks & Crisps","3.1","83.4"
"ID_598","Birra Moretti Premium Lager Beer Bottle 660ml","Birra Moretti Premium Lager Beer Bottle 660ml","05035766062523","BIRRA MORETTI","Drinks","Beer & Cider","Beer - Lager","Beer - Bottled Lager","4.0","100.0"
"ID_599","Tesco Apple Mango, Strawberry & Raspberry 220G","Tesco Apple, Mango Strawberry And Raspberry 210G","00000003450857","TESCO","Fresh Food","Fresh Fruit","Fruit Pots, Platters & Packs","Mixed Fruit","","96.8"
"ID_600","Tesco Halloumi Cheese With Chilli 225 G","Tesco Finest Halloumi Cheese 225 G","05052320391677","TESCO FINEST","Fresh Food","Cheese","Specialty & Continental Cheese","Halloumi","4.6","91.3"
"ID_601","Doritos Dippers Cool Original Tortilla Chips 270G","Doritos Extra Flamin' Hot Tortilla Chips 163g","05000328026282","DORITOS","Food Cupboard","Crisps, Snacks, Nuts & Popcorn","Sharing Crisps & Snacks","Crisps - Tortilla Chips, Nachos & Dips","3.8","91.6"
"ID_602","Tenzing Natural Energy Drink 250Ml","Tenzing Natural Energy Drink - Lime & Mint 4 x 330ml","05060444851106","TENZING","Drinks","Sports & Energy Drinks","Energy Drinks","Regular Energy Drinks","5.0","83.4"
"ID_603","Tesco All Butter Chocolate Croissant 2 Pack","Tesco All Butter Chocolate Croissant 2 Pack","00287210000000","TESCO","Bakery","Croissants, Brioche & Pastries","Croissants","Croissants","3.2","100.0"
"ID_604","Freixenet Cordon Rosado Seco 75Cl","Freixenet Cordon Rosado Seco 75Cl","08410036801212","FREIXENET","Drinks","Wine","Prosecco, Champagne & Sparkling Wine","Sparkling Wine","4.2","100.0"
"ID_605","Gordon's Special Dry London Gin Bottle 37.5% Vol 1L","Gordon's Special Dry London Gin Bottle 37.5% Vol 1L","05000289110808","GORDON'S","Drinks","Spirits","Gin","Classic & Dry Gin","4.7","100.0"
"ID_606","Tesco No Added Sugar Cranberry Juice Drink 1 Litre","Tesco No Added Sugar Cranberry Juice Drink 1 Litre","05053947250057","TESCO","Drinks","Juices, Smoothies & Wellness Drinks","Long Life Juice","Long Life Cranberry Juice","2.9","100.0"
"ID_607","Heinz Seriously Good Mayonnaise Light 420G","Heinz Seriously Good Light Mayonnaise 420g","05000157076403","HEINZ","Food Cupboard","Table Sauces, Olives, Pickles & Chutney","Mayonnaise","Mayonnaise","3.6","99.0"
"ID_608","Tesco Finest Spanish Chorizo 225G","Tesco Finest Spanish Chorizo Ring 225G","05057373620309","TESCO FINEST","Fresh Food","Cooked Meats, Antipasti & Dips","Chorizo, Salami & Continental Meats","Chorizo","2.6","95.5"
"ID_609","Pringles Sizzl'n Extra Hot Cheese & Chilli 180G","Pringles Hot Flamin' Cheese Flavour Crisps 160g","05053990175888","PRINGLES","Food Cupboard","Crisps, Snacks, Nuts & Popcorn","Sharing Crisps & Snacks","Sharing Crisps In A Tube","4.3","80.9"
"ID_610","Tesco Italian Chopped Tomatoes 400G","Tesco Italian Chopped Tomatoes 400G","05031021164032","TESCO","Food Cupboard","Tins, Cans & Packets","Tomatoes, Passata & Puree","Chopped Tomatoes","3.8","100.0"
"ID_611","Pepsi Max No Sugar Cola Bottle 2L","Pepsi Max No Sugar Cola Bottle 2L","05011026005592","PEPSI","Drinks","Fizzy & Soft Drinks","Cola","Diet Cola & Sugar Free Cola","4.6","100.0"
"ID_612","Southern Comfort Whiskey Flavoured Liqueur 70cl","Southern Comfort Original Liqueur with Whiskey 70cl","01210000100214","SOUTHERN COMFORT","Drinks","Spirits","Whisky","Bourbon, Irish & Imported Whiskey","4.7","94.1"
"ID_613","Pringles Sizzl'N Kickin' Sour Cream Sharing Crisps 180g","Pringles Hot Kickin' Sour Cream Flavour Crisps 160g","05053990175826","PRINGLES","Food Cupboard","Crisps, Snacks, Nuts & Popcorn","Sharing Crisps & Snacks","Sharing Crisps In A Tube","4.3","85.2"
"ID_614","Coors Light 10X440ml","Bud Light 10X440ml","05014379002850","BUDWEISER","Drinks","Beer & Cider","Beer - Lager","Beer - Bigger Pack Lager","","57.3"
"ID_615","Tesco Plant Chef 2 Meat Free Burgers 226G","Tesco Plant Chef 2 Meat Free Burgers 226G","05059697384349","TESCO PLANT CHEF","Fresh Food","Chilled Vegetarian & Vegan","Burgers","Vegan Burgers & Vegetarian Burgers","3.2","100.0"
"ID_616","Heinz Classic Barbecue Sauce 480G","Heinz Classic Barbecue Sauce 480G","00000050457878","HEINZ","Food Cupboard","Table Sauces, Olives, Pickles & Chutney","BBQ, Burger, Pizza Sauces & Marinades","Barbecue Sauce","4.8","100.0"
"ID_617","Tesco 4 Large White Baps","Tesco Large White Baps 4 pack","05059512729744","TESCO","Bakery","Bread & Rolls","Bread Rolls","White Rolls","4.1","88.8"
"ID_618","Tesco Small Disposable Charcoal Bbq Tray","Tower Charcoal BBQ Starter Pan","05056462327433","Tower","Marketplace","Garden & DIY","Outdoor Cooking & Heating","BBQs & Smoker Accessories","","77.9"
"ID_619","Peroni Nastro Azzurro 12X330ml","Peroni Nastro Azzurro Beer Lager Bottles 12x330ml","08008440112682","PERONI","Drinks","Beer & Cider","Beer - Lager","Beer - Bottled Lager","4.8","71.1"
