"UID","name","matched_name","barcode","brand","category_1","category_2","category_3","category_4","rating","match_score"
"ID_859","Tesco Finest Peas, Leeks & Pancetta 250G","Tesco Finest Leek Potato & West Country Cheddar Soup 600G","05059697701559","TESCO FINEST","Fresh Food","Chilled Soup, Sandwiches & Salad Pots","Tesco Finest & Premium Soup","Tesco Finest & Premium Soup","3.1","65.4"
"ID_860","Tesco Hot & Spicy Breaded Chicken Mini Fillets 305G","Tesco Hot & Spicy Breaded Chicken Mini Fillets 305G","05052319337785","TESCO","Fresh Food","Fresh Meat & Poultry","Breaded Chicken","Chicken Fillets & Burgers","4.3","98.1"
"ID_861","Nandos Squeezy Perinaise 265G","Nandos Squeezy Perinaise 265G","06003770009130","NANDO'S","Food Cupboard","Table Sauces, Olives, Pickles & Chutney","Mayonnaise","Flavoured Mayonnaise","4.7","100.0"
"ID_862","Warburtons White Sliced Sandwich Rolls 6 Pack","Warburtons Sliced White Sandwich Rolls 4 Pack","05010044009162","WARBURTONS","Bakery","Bread & Rolls","Bread Rolls","White Rolls","4.6","98.5"
"ID_863","Tesco Blueberries 150G +50% Ef (C)","Tesco Blueberries 150G","00000003257005","TESCO","Fresh Food","Fresh Fruit","Berries & Cherries","Blueberries","3.8","94.0"
"ID_864","innocent Smoothie Mangoes Passion Fruits & Apples 750ml","Innocent Smoothie Mangoes Passion Fruits & Apples 250ml","05038862340106","INNOCENT","Drinks","On The Go Drinks","Juice & Smoothies","Juice & Smoothies","5.0","99.4"
"ID_865","Lucozade Energy Orange 500Ml","Lucozade Energy Orange 500Ml","05054267000216","LUCOZADE","Drinks","On The Go Drinks","Sports, Energy & Wellness Drinks","Sports, Energy & Wellness Drinks","4.7","100.0"
"ID_866","Tesco 6 Mini Melton Mowbray Pork Pies 300G (C)","Tesco Melton Mowbray Pork Pies 6 Pack 300g","05018374007186","TESCO","Fresh Food","Pies, Pasties, Quiches & Snacking","Pork Pies & Scotch Eggs","Pork Pies","3.3","95.7"
"ID_867","Tesco British Skimmed Milk 2.272L, 4 Pints","Tesco British Skimmed Milk 2.272L, 4 Pints","05000436589419","TESCO","Fresh Food","Milk, Butter & Eggs","Milk","Skimmed Milk","3.3","100.0"
"ID_868","Tesco Indian Onion Bhajis 280G","Tesco Indian Onion Bhajis 294G","05052909660590","TESCO","Fresh Food","Ready Meals","Indian Ready Meals","Indian Ready Meal Starters & Sides","2.6","98.0"
"ID_869","Tesco Mature Cheddar 400G","Tesco Mature Cheddar 400G","05057753909536","TESCO","Fresh Food","Cheese","Cheddar Cheese","Mature Cheddar Cheese","4.1","100.0"
"ID_870","Fairy Lemon Washing Up Liquid 654Ml","Fairy Lemon Washing Up Liquid 654Ml","08006540994412","FAIRY","Household","Dishwashing","Washing Up Liquid","Scented Washing Up Liquid","3.2","100.0"
"ID_871","Heinz Baked Beans No Added Sugar In Tomato Sauce 4 X415g","Heinz No Added Sugar Baked Beans in Tomato Sauce 4 x 200g","05000157150981","HEINZ","Food Cupboard","Tins, Cans & Packets","Baked Beans","Tinned Baked Beans","4.6","97.3"
"ID_872","Tesco Sweet Potatoes 1Kg (C)","Tesco Sweet Potatoes 1Kg","00000003314500","TESCO","Fresh Food","Fresh Vegetables & Fresh Flowers","Potatoes & Sweet Potatoes","Sweet Potato","4.4","100.0"
"ID_873","Nature Valley Protein Salted Caramel Nut Cereal Bar 40g","Nature Valley Protein Salted Caramel Nut Cereal Bar 40g","08410076900319","NATURE VALLEY","Treats & Snacks","Biscuits & Cereal Bars","Cereal Bars & On the Go Snack Bars","Protein Bars","","100.0"
"ID_874","Tesco Sparkling Water Lemon & Lime 1 Litre","Tesco Sparkling Water Lemon & Lime 1 Litre","05031021883926","TESCO","Drinks","Water","Flavoured Sparkling Water","Single Bottled Flavoured Sparkling Water","4.6","100.0"
"ID_875","GalbaniÂ ItalianÂ MozzarellaÂ Cheese 125g","Galbani Italian Mozzarella Cheese 125g","08000430133035","GALBANI","Fresh Food","Cheese","Specialty & Continental Cheese","Mozzarella, Mascarpone & Ricotta","4.6","94.2"
"ID_876","Sacla Sun Dried Tom Pesto 190G","Sacla Sun Dried Tom Pesto 190G","08001060000261","SACLA","Food Cupboard","Cooking Sauces, Meal Kits & Sides","Italian","Pesto","5.0","100.0"
"ID_877","Innocent Bolt From The Blue Juice 750Ml","Innocent Plus Blue Bolt Guava & Lime Juice with Vitamins 750ml","05038862138697","INNOCENT","Drinks","Juices, Smoothies & Wellness Drinks","Fresh Juice","Mixed Fruit & Tropical Juice","4.9","75.3"
"ID_878","Rizla Regular Green 50","Rizla Green Papers","00000050973613","RIZLA","Home & Ents","Tobacco & Alternatives","Rolling Tobacco","Cigarette Papers, Filters & Tips","5.0","66.3"
"ID_879","Lemons Each","Tesco Lemons Each","00223780000000","TESCO","Fresh Food","Fresh Fruit","Oranges, Lemons & Citrus Fruit","Lemons","2.6","84.6"
"ID_880","Tesco British Chicken Thighs 600G (C)","Tesco British Chicken Thigh Fillets 600G","05054269362978","TESCO","Fresh Food","Fresh Meat & Poultry","Fresh Chicken","Chicken Thighs &  Legs ","2.4","89.0"
"ID_881","Corona Extra Lager 620Ml","Corona Extra Lager 620Ml","05014379014457","CORONA","Drinks","Beer & Cider","Beer - Lager","Beer - Mexican Lager","5.0","100.0"
"ID_882","Tesco Lightly Seeded Loaf 800G","Tesco Lightly Seeded White Bread Loaf 800g","05059697712784","TESCO","Bakery","Bread & Rolls","Seeded Bread","Seeded Bread","4.2","92.8"
"ID_883","Doritos Tortilla Chips Tangy Cheese Grab Bag Crisps 48g","Doritos Tortilla Chips Tangy Cheese Sharing Bag Crisps 180g","05000328028651","DORITOS","Food Cupboard","Crisps, Snacks, Nuts & Popcorn","Sharing Crisps & Snacks","Sharing Party Snacks & Crisps","4.6","96.2"
"ID_884","Pizza Express American Pizza 250G","Pizza Express American Pizza 250G","05024530005316","PIZZA EXPRESS","Fresh Food","Fresh Pizza, Pasta & Garlic Bread","Fresh Pizza","Tesco Finest & Premium Pizza","3.3","100.0"
"ID_885","Pizza Express Garlic Dough Balls 95 G","Pizza Express Dough Balls 200G","05010217223838","PIZZA EXPRESS","Fresh Food","Fresh Pizza, Pasta & Garlic Bread","Chilled Garlic Bread & Dough Balls","Dough Balls","4.5","85.9"
"ID_886","For Goodness Shakes Recovery Milk Chocolate 475Ml","For Goodness Shakes Protein Chocolate Shake 471ml","05060075672712","FOR GOODNESS SHAKE","Drinks","Milk & Milkshakes","Protein Shakes","Protein Shakes","","87.4"
"ID_887","Florette Crispy 90G","Florette Crispy Salad Strong 140g","05060735732886","FLORETTE","Fresh Food","Fresh Salad, Coleslaw & Sandwich Fillers","Lettuce & Salad bags","Salad Bags","4.2","74.5"
"ID_888","19 Crimes Revolutionary Rose Wine 750Ml","19 Crimes Revolutionary Rose Wine 750Ml","09311220011112","19 CRIMES","Drinks","Wine","Rose Wine","Dry Rose Wine","2.5","100.0"
"ID_889","Cofresh Hot Bombay Mix 325G","Cofresh Hot Bombay Mix 325G","05026489495682","COFRESH","Food Cupboard","World Foods","South Asian","South Asian Snacks","4.0","100.0"
"ID_890","Tesco Southern Fried Breaded Chicken Mini Fillets 305G (C","Tesco Breaded Chicken Strips 400g","05057753921651","TESCO","Frozen Food","Meat & Poultry","Coated Chicken & Turkey","Frozen Takeaway Chicken","3.4","85.9"
"ID_891","Peroni Nastro Azzurro Lager Beer 500Ml","Peroni Nastro Azzurro Beer Lager Bottle 500ml","08008440212474","PERONI","Drinks","Beer & Cider","Beer - Lager","Beer - Single Bottled Lager","4.7","94.5"
"ID_892","Nissin Soba Chilli Instant Noodles 92G","Nissin Soba Chilli Instant Noodles 92G","05997523315535","NISSIN","Food Cupboard","Instant Noodles & Easy Meals","Instant Noodle Pots","Instant Noodle Pots","4.8","100.0"
"ID_893","Captain Kombucha California Rasp Water 400Ml","Fix8 Kombucha Sicilian Citrus 4 x 250ml","05070000550053","FIX8","Drinks","Juices, Smoothies & Wellness Drinks","Wellbeing Drinks","Kombucha","","53.7"
"ID_894","Eat Natural Bars Maple Syrup Pecan & Peanut 45G","Eat Natural Protein Bars - Maple Syrup, Pecans & Peanuts 3 Pack 40g","08000500417225","EAT NATURAL","Food Cupboard","Free From","Gluten Free","Gluten Free Snack, Nuts & Fruit Bars","","87.3"
"ID_895","Tesco Oriental Flavoured Nut Mix 25G","Tesco Nut Bites Mix Baklava Flavour 25G","05059697684951","TESCO","Fresh Food","Fresh Fruit","Dried Fruit, Nuts & Seeds","Mixed Bags & Snack Packs","2.5","79.4"
"ID_896","Tesco Kitchen Towel 2 Rolls","Tesco Kitchen Towel 2 Rolls","05057753933005","TESCO","Household","Kitchen Roll","Medium Packs (2-3 Rolls)","Medium Packs Kitchen Rolls","3.0","100.0"
"ID_897","Tesco Large Dishcloth 6Pack Roll","Tesco Large Dishcloth Roll 4 Pack","05057008860735","TESCO","Household","Cleaning","Cloths, Scourers & Dusters","Cloths","4.1","93.1"
"ID_898","Tesco Dishwasher Salt 1Kg","Tesco Dishwasher Salt 1Kg","05057753894740","TESCO","Household","Dishwashing","Dishwasher Cleaner, Rinse Aid & Salt","Dishwasher Salt","3.5","100.0"
"ID_899","Mr Muscle Oven Cleaner 300Ml +66% Extra Free","Mr Muscle Oven Cleaner 300ml","05000204890938","MR MUSCLE","Household","Cleaning","Hob & Oven Cleaner","Hob & Oven Cleaner","4.2","93.1"
"ID_900","Tesco Microfibre Cloth 4 Pack","Tesco Microfibre Cloth 4 Pack","05057008760776","TESCO","Household","Cleaning","Cloths, Scourers & Dusters","Microfibre Cloths & Pads","4.0","100.0"
"ID_901","La Vieille Ferme White Wine 750Ml","La Vieille Ferme White Wine 750Ml","03296180005400","LA VIEILLE FERME","Drinks","Wine","White Wine","French White Wine","4.2","100.0"
"ID_902","Glaceau Smartwater 600Ml","Illuminate RPET 600ml Water Bottle - Ocean Blue - One Size","05063574581004","Generic","Marketplace","Cook & Dine","Food Storage & Water Bottles","Water Bottles & Coolers","","59.6"
"ID_903","KIND Protein Dark Chocolate snack Bar 50g","KIND Protein Dark Chocolate snack Bar 50g","05000159528696","KIND","Treats & Snacks","Biscuits & Cereal Bars","Cereal Bars & On the Go Snack Bars","Gluten Free & Vegan Bars","4.8","100.0"
"ID_904","Finish Dishwasher Cleaner Lem250ml +100%Ex","Finish Dishwasher Cleaner Twin Pack - Regular 500ml","05011417548516","FINISH","Household","Dishwashing","Dishwasher Cleaner, Rinse Aid & Salt","Dishwasher Cleaner","4.8","86.1"
"ID_905","Glade Aerosol Air Freshener Relaxing Zen 300ml","Glade Relaxing Zen Air Freshener Aerosol Spray 300ml","05000204771749","GLADE","Household","Air Fresheners & Home Fragrance","Aerosol & Room Sprays","Aerosol & Room Spray","3.0","95.1"
"ID_906","Fulfil Chocolate Hazelnut Whip Vitamin & Protein Bar 40G","Fulfil Vitamin & Protein Bar - Chocolate Hazelnut Whip Flavour 40g","05391532123950","FULFIL","Food Cupboard","Chocolate, Sweets, Mints & Chewing Gum","Single Chocolate Bars & Sweets","Protein Bars","5.0","97.4"
"ID_907","Buxton Still Natural Mineral Water Sports Cap 1L","Buxton Still Natural Mineral Water Sports Cap 1L","07613031214839","BUXTON","Drinks","Water","Still Water","Single Bottled Water","4.7","100.0"
"ID_908","Tesco Mixed Leaf Salad 90G","Tesco Mixed Leaf Salad 120G","00000003267660","TESCO","Fresh Food","Fresh Salad, Coleslaw & Sandwich Fillers","Lettuce & Salad bags","Salad Bags","3.8","96.5"
"ID_909","Frylight Olive Oil Spray 190Ml","Frylight Olive Oil Spray 190Ml","05000442007594","FRYLIGHT","Food Cupboard","Cooking Ingredients","Oils & Cooking Fats","Olive Oil","3.9","100.0"
"ID_910","Tesco Radish 240G","Tesco Radish Pack 240G","00000010069523","TESCO","Fresh Food","Fresh Salad, Coleslaw & Sandwich Fillers","Spring Onions, Radish & Beetroot","Radish","4.0","93.3"
"ID_911","Tesco Whole Cucumber Each","Tesco Whole Cucumber Each","00000010015599","TESCO","Fresh Food","Fresh Salad, Coleslaw & Sandwich Fillers","Cucumber","Cucumber","3.2","100.0"
"ID_912","Method Antibacterial All Purpose Cleaner Spray Wild Rhubarb 828Ml","Method Antibacterial All Purpose Cleaner Spray Wild Rhubarb 828Ml","00817939012079","METHOD","Household","Cleaning","Cleaning & Antibacterial Sprays & Liquids","Antibacterial Sprays","4.8","100.0"
"ID_913","Tesco Citrus Anti Bact Wipes 80Pk Plus 20 Free","Tesco Citrus Antibacterial Wipes 40 Wipes","05051140157111","TESCO","Household","Cleaning","Cleaning & Antibacterial Wipes","Antibacterial Wipes","3.0","84.5"
"ID_914","Tesco Finest 2 Thai Inspired Salmon & Cod F/Cakes 290G","Tesco Finest 2 Thai Inspired Salmon & Cod F/Cakes 290G","05059697739521","TESCO FINEST","Fresh Food","Chilled Fish & Seafood","Fishcakes & Fish Fingers","Chilled Fishcakes","4.2","100.0"
"ID_915","Old El Paso Fajita Dinner Kit 50% Extra Free","Old El Paso Extra Mild Fajita Dinner Kit 476G","08410076471475","OLD EL PASO","Food Cupboard","Cooking Sauces, Meal Kits & Sides","Meal Kits","Mexican & Latin American Meal Kits","4.6","91.7"
"ID_916","Tesco Finest Strawberries 300G (C)","Tesco Finest Strawberries 227G","00000003340684","TESCO FINEST","Fresh Food","Fresh Fruit","Berries & Cherries","Strawberries","3.9","96.9"
"ID_917","Highland Spring Still Water 1.5 Litre","Highland Spring Still Water 1.5 Litre","05010459005025","HIGHLAND SPRING","Drinks","Water","Still Water","Single Bottled Water","5.0","100.0"
"ID_918","Tesco British Whole Milk 2.272L, 4 Pints","Tesco British Whole Milk 2.272L, 4 Pints","05000436589341","TESCO","Fresh Food","Milk, Butter & Eggs","Milk","Whole Milk","3.6","100.0"
"ID_919","Tesco Sweet Chilli Stir Fry Sauce 180G","Tesco Sweet Chilli Stir Fry Sauce 165g","00000003399835","TESCO","Fresh Food","Fresh Vegetables & Fresh Flowers","Stir Fry Vegetables, Sauce & Noodles","Stir Fry Sauces","","98.6"
"ID_920","Tesco Egg Noodles 300G (C)","Tesco Egg Noodles 300G","00000003264690","TESCO","Fresh Food","Fresh Vegetables & Fresh Flowers","Stir Fry Vegetables, Sauce & Noodles","Stir Fry Noodles & Rice","3.6","100.0"
"ID_921","Tesco Pepper Stir Fry Mix 320G","Tesco Pepper Stir Fry 320g","00000003409152","TESCO","Fresh Food","Fresh Vegetables & Fresh Flowers","Stir Fry Vegetables, Sauce & Noodles","Stir Fry Vegetables","","96.9"
"ID_922","Tesco Finest Cooked Jumbo King Prawns 150G","Tesco Finest Cooked Jumbo King Prawns 150G","05057753599294","TESCO FINEST","Fresh Food","Chilled Fish & Seafood","Prawns & Seafood","Prawns","3.6","100.0"
"ID_923","Snaffling Pig Pork Scratchings Salted 45G","Mr Porky Original Scratchings 65G","05010052112700","MR PORKY","Food Cupboard","Crisps, Snacks, Nuts & Popcorn","Meat Snacking","Pork Scratchings","4.3","72.8"
"ID_924","Tesco Finest Greek Style Chicken & Feta Seeded Tortilla Wrap","Tesco Finest Chargrilled Chicken Spicy 'Nduja Seeded Tortilla Wrap","05059697399503","TESCO FINEST","Fresh Food","Chilled Soup, Sandwiches & Salad Pots","Lunch Meal Deals","£5.50 Meal Deal Mains","1.8","84.3"
"ID_925","Volvic Natural Bottled Mineral Still Water 1L","Volvic Natural Bottled Mineral Still Water 1L","03057640136993","VOLVIC","Drinks","Water","Still Water","Single Bottled Water","5.0","100.0"
"ID_926","Philadelphia Original Soft Cream Cheese 280G","Philadelphia Original Soft Cream Cheese 280G","07622201695521","PHILADELPHIA","Fresh Food","Cheese","Soft & Spreadable Cheese","Soft Cheese & Cream Cheese","4.7","100.0"
"ID_927","Tesco Bbq Chicken With Jasmine Rice 400G","Tesco Bbq Chicken With Jasmine Rice 400G","05059697727771","TESCO","Fresh Food","Ready Meals","Ready Meals for 1","British Classics Ready Meals for 1","3.7","97.4"
"ID_928","Tesco Watercress Spinach & Rocket 105G (C)","Tesco Watercress, Spinach & Rocket 80g","00000003268841","TESCO","Fresh Food","Fresh Salad, Coleslaw & Sandwich Fillers","Lettuce & Salad bags","Salad Bags","3.2","94.9"
"ID_929","New York Bakery The Original Bagels 5Pack","New York Bakery Co The Original Bagels 5 Pack","05018297006464","NEW YORK BAKERY","Bakery","Bread & Rolls","Bagels","Bagels","5.0","96.9"
"ID_930","Heinz Beanz No Added Sugar In Tomato Sauce 415G","Heinz No Added Sugar Baked Beans in Tomato Sauce 4 x 200g","05000157150981","HEINZ","Food Cupboard","Tins, Cans & Packets","Baked Beans","Tinned Baked Beans","4.6","90.8"
"ID_931","Arctic Coffee Cafe Latte 330Ml","Arctic Coffee Cafe Latte 330Ml","05000316000522","CREDITON DAIRY","Drinks","On The Go Drinks","Iced Coffee","Iced Coffee","4.8","100.0"
"ID_932","Hilltop Squeezy Blossom Honey 340G","Hilltop Squeezy Blossom Honey 340G","05060298571250","HILLTOP","Food Cupboard","Jams, Sweet & Savoury Spreads","Honey & Syrups","Squeezy Honey","4.4","100.0"
"ID_933","Tesco Chinese Style Chicken Curry With Egg Fried Rice 400G","Tesco Chinese Style Chicken Curry With Egg Fried Rice 400G","05059697767036","TESCO","Fresh Food","Ready Meals","Chinese, Thai & Asian Ready Meals","Thai, Asian & Chinese Ready Meals for 1","3.9","97.5"
"ID_934","Volvic Touch of Fruit Lemon & Lime Still Flavoured Water 750ml","Volvic Touch of Fruit Lemon & Lime Still Flavoured Water 750ml","03057640406423","VOLVIC","Drinks","Water","Flavoured Still Water","Single Bottled Flavoured Still Water","5.0","100.0"
"ID_935","Graze Lively Lemon Flapjack 53G","Graze Lemon Blueberry Oat Boosts Flapjack Snack 4x30G","05055958705427","GRAZE","Food Cupboard","Biscuits & Cereal Bars","Cereal Bars & Breakfast Bars","Protein Bars","4.7","74.5"
"ID_936","Tesco Lamb Rogan Josh With Pilau Rice 400G","Tesco Lamb Rogan Josh With Pilau Rice 400G","05059697688423","TESCO","Fresh Food","Ready Meals","Ready Meals for 1","Indian Ready Meals for 1","3.4","100.0"
"ID_937","Tesco Mango (C)","Tesco Mango (C)","00000010056509","TESCO","Fresh Food","Fresh Fruit","Mango, Kiwi & Exotic Fruit","Mango","5.0","91.7"
"ID_938","Beavertown Neck Oil Session Ipa 4X330ml","Beavertown Neck Oil Session Ipa 4X330ml","05060386621058","BEAVERTOWN","Drinks","Beer & Cider","Craft Beer","IPA","3.2","100.0"
"ID_939","Tesco Indian Kitchen Chicken Tikka Biryani 400G","Tesco Indian Kitchen Chicken Tikka Biryani 400G","05057008495234","TESCO","Fresh Food","Ready Meals","Ready Meals for 1","Indian Ready Meals for 1","2.4","100.0"
"ID_940","Arctic Coffee Cafe Latte 1 Litre","Arctic Coffee Cafe Latte 1 Litre","05000316000720","ARCTIC COFFEE","Drinks","On The Go Drinks","Iced Coffee","Iced Coffee","5.0","100.0"
"ID_941","Mccain Crispy French Fries 1Kg","McCain Crispy French Fries 1.4kg","05010228001845","MCCAIN","Frozen Food","Chips, Potatoes & Sides","Chips & French Fries","Frozen Chips - French Fries","4.1","98.2"
"ID_942","San Pellegrino Sparkling Natural Mineral Water 1L","San Pellegrino Sparkling Natural Mineral Water 1L","08002270018213","SAN PELLEGRINO","Drinks","Water","Sparkling Water","Single Bottled Sparkling Water","4.0","100.0"
"ID_943","Tesco Asparagus Tips 125G (C)","Tesco Asparagus Tips 125G","00000010024614","TESCO","Fresh Food","Fresh Vegetables & Fresh Flowers","Peas, Beans, Sweetcorn & Asparagus","Asparagus","2.2","100.0"
"ID_944","Tesco Tenderstem 220G (C)","Tesco Tenderstem & Mixed Vegetables 160G","00000003277416","TESCO","Fresh Food","Fresh Vegetables & Fresh Flowers","Prepared Vegetables","Prepared Mixed Vegetables","4.3","73.9"
"ID_945","Tesco Chicken Thigh Fillets Skinless & Boneless 600G","Tesco Chicken Thigh Fillets Skinless & Boneless 600G","05057753917999","TESCO","Fresh Food","Fresh Meat & Poultry","Fresh Chicken","Chicken Thighs &  Legs ","5.0","97.4"
"ID_946","Tesco Smoked Salmon 120G","Tesco Finest 12 Scottish Smoked Salmon Canapes 120g ","05059697741104","TESCO FINEST","Fresh Food","Chilled Fish & Seafood","Salmon & Trout","Chilled Smoked Salmon","4.0","79.3"
"ID_947","Philadelphia Original Soft Cream Cheese 165G","Philadelphia Original Soft Cream Cheese 165G","07622201693916","PHILADELPHIA","Fresh Food","Cheese","Soft & Spreadable Cheese","Soft Cheese & Cream Cheese","4.7","100.0"
"ID_948","Tesco Black Beans 400G","Tesco Chicken & Black Bean With Egg Fried Rice 400G","05059697698040","TESCO","Fresh Food","Ready Meals","Chinese, Thai & Asian Ready Meals","Thai, Asian & Chinese Ready Meals for 1","3.6","59.4"
"ID_949","Summer Pride Chopped Tomatoes 400G","Summer Pride Chopped Tomatoes 400G","05010793380598","SUMMER PRIDE","Food Cupboard","World Foods","South Asian","South Asian Groceries","2.4","100.0"
"ID_950","Domestos Original 750Ml +33% Extra Free","Domestos Gold Original Thick Bleach 750ml","08720182976420","DOMESTOS","Household","Bathroom Cleaners & Toilet Care","Bleach","Bleach","","63.3"
"ID_951","Dr Beckmann Carpet Cleaner Brush 650Ml","Dr Beckmann Carpet Cleaner Brush 650Ml","05010287314504","DR BECKMANN","Household","Cleaning","Floor & Carpet Cleaner","Carpet Cleaner","4.6","100.0"
"ID_952","Dri-Pak Table Salt 750G","Dri Pak Soda Crystals 1Kg","05011289000297","DRI PAK","Household","Laundry","Washing Machine Cleaner & Limescale Prevention","Soda Crystals","4.7","62.6"
"ID_953","Tesco British Pork Belly Sliced 550G","Tesco British Pork Belly Slices 550g","05059697777622","TESCO","Fresh Food","Fresh Meat & Poultry","Fresh Pork & Gammon","Pork Belly & Ribs","3.3","96.6"
"ID_954","Kettle S/Salt & Black Peppercorns Potato Chips 130G","Kettle Sea Salt & Black Peppercorns Potato Chips 130G","05017764004019","KETTLE","Food Cupboard","Crisps, Snacks, Nuts & Popcorn","Sharing Crisps & Snacks","Premium & Hand Cooked Sharing Crisps","","96.2"
"ID_955","Tesco Limes Minimum 5 Pack","Tesco Limes Minimum 5 Pack","00000010098479","TESCO","Fresh Food","Fresh Fruit","Oranges, Lemons & Citrus Fruit","Limes","2.7","100.0"
"ID_956","Zip 2Kg Charcoal Briquettes","Zip 2Kg Charcoal Briquettes","00834554006955","SUPPLIER","Home & Ents","Garden & Outdoor","BBQ Fuel, Charcoal & Accessories","Charcoal Briquettes","4.6","90.8"
"ID_957","Tesco Coronation Chicken Sandwich","Tesco Coronation Chicken Sandwich","00000003275351","TESCO","Fresh Food","Chilled Soup, Sandwiches & Salad Pots","Sandwiches, Wraps & Sushi","Sandwiches","3.7","100.0"
"ID_958","Tesco Wafer Thin Honey Roast Ham 125G","Tesco Wafer Thin Honey Roast Ham 125G","05057967620883","TESCO","Fresh Food","Cooked Meats, Antipasti & Dips","Ham","Honey Roast Ham","4.3","100.0"
"ID_959","Tesco Organic Garlic 3 Pack","Tesco Organic Garlic 3 Pack","00000010081945","TESCO ORGANIC","Fresh Food","Fresh Vegetables & Fresh Flowers","Fresh Chillies, Herbs, Garlic & Ginger","Garlic Cloves","1.5","100.0"
"ID_960","Tesco Gnocchi 500G","Tesco Gnocchi 500G","05052909678823","TESCO","Food Cupboard","Dried Pasta, Rice, Noodles & Cous Cous","Pasta & Spaghetti","Pasta - Gnocchi, Polenta & Orzo","2.4","100.0"
"ID_961","Tesco Balsamic Vinegar Of Modena 250Ml","Tesco Balsamic Vinegar Of Modena 250Ml","05000358462043","TESCO","Food Cupboard","Cooking Ingredients","Vinegars","Balsamic Vinegar & Balsamic Glaze","3.6","100.0"
"ID_962","Tesco Tzatziki 170G","Tesco Tzatziki Dip 200G","00000010065877","TESCO","Fresh Food","Cooked Meats, Antipasti & Dips","Houmous & Dips","Creamy Dips & Tzatziki","4.0","83.7"
"ID_963","Tesco Baby Plum Tomatoes 325G","Tesco Baby Plum Tomatoes 300G","00000003403112","TESCO","Fresh Food","Fresh Salad, Coleslaw & Sandwich Fillers","Tomatoes","Baby & Cherry Tomatoes","3.8","97.3"
"ID_964","Tesco All Butter Chocolate Croissant","Tesco All Butter Chocolate Croissant","00000003269299","TESCO","Bakery","From Our Bakery","Croissants & Pastries From Our Bakery","Single Croissants & Danish Pastries","3.7","100.0"
"ID_965","Charlie Bigham's Chicken Tikka Masala 403G","Charlie Bigham's Chicken Tikka Masala 403G","05033665212407","CHARLIE BIGHAMS","Fresh Food","Ready Meals","Tesco Finest & Premium Ready Meals","Premium & Tesco Finest Ready Meals For 1","4.1","100.0"
"ID_966","Tesco Smoked Bacon & Ketchup Sandwich","Tesco Brie & Smoked Bacon Sandwich with Chilli Jam","05059697394584","TESCO","Fresh Food","Chilled Soup, Sandwiches & Salad Pots","Lunch Meal Deals","£4 Meal Deal Mains","5.0","84.2"
"ID_967","Peperami Red Hot Stick 22.5G","Peperami Red Hot Stick 22.5G","04251097405308","PEPERAMI","Fresh Food","Chilled Soup, Sandwiches & Salad Pots","Snacks","Pastries & Meat Snacks","3.0","100.0"
"ID_968","Eat Natural Fruit & Nut Bar Almond & Apricot with a Yoghurt Coating 50g","Eat Natural Almond & Apricot Fruit & Nut Bars with a Yoghurt Coating 40g","08000500417539","EAT NATURAL","Treats & Snacks","Biscuits & Cereal Bars","Cereal Bars & On the Go Snack Bars","Treat & Cereal Bars","","97.4"
"ID_969","Evian Natural Bottled Mineral Still Water 750ml","Evian Natural Bottled Mineral Still Water 750ml","03068320014067","EVIAN","Drinks","Water","Still Water","Single Bottled Water","4.6","100.0"
"ID_970","Tesco Chicken & Chorizo Sandwich","Tesco Chicken & Chorizo Sandwich","05057753928209","TESCO","Fresh Food","Chilled Soup, Sandwiches & Salad Pots","Sandwiches, Wraps & Sushi","Sandwiches","3.9","100.0"
"ID_971","Walkers Max Strong Hot Sauce Blaze Grab Bag Crisps 50g","Walkers Prawn Cocktail Grab Bag Crisps 45g","05000328270890","WALKERS","Food Cupboard","Crisps, Snacks, Nuts & Popcorn","Single Crisps & Snacks","Single Crisps & Snacks","5.0","83.3"
"ID_972","Kettle Chips Sea Salt & Balsamic Vinegar Crisps 40 G","Kettle Chips Sea Salt & Balsamic Vinegar Crisps 40 G","05017764119027","KETTLE","Food Cupboard","Crisps, Snacks, Nuts & Popcorn","Single Crisps & Snacks","Single Crisps & Snacks","5.0","100.0"
"ID_973","Tesco Chicken Slice","Tesco 2 Chicken & Mushroom Slices 300G","05052526025956","TESCO","Fresh Food","Pies, Pasties, Quiches & Snacking","Sausage Rolls, Pasties & Slices","Pasties & Slices","2.0","82.8"
"ID_974","Tesco Steak Slice","Tesco 2 Steak Slices 300g","05057008392830","TESCO","Fresh Food","Pies, Pasties, Quiches & Snacking","Sausage Rolls, Pasties & Slices","Pasties & Slices","2.3","86.0"
"ID_975","Red Bull Energy Drink Sugar Free 473Ml","Red Bull Energy Drink Sugar Free 473Ml","00000090433115","RED BULL","Drinks","On The Go Drinks","Sports, Energy & Wellness Drinks","Sports, Energy & Wellness Drinks","5.0","100.0"
"ID_976","Heineken Lager Beer Bottle 650ml","Heineken Lager Beer Bottle 650ml","08712000022662","HEINEKEN","Food Cupboard","World Foods","Eastern European","Polish Beer & Spirits","4.8","100.0"
"ID_977","Cobra Indian Lager 620Ml","Cobra Premium World Lager Beer Bottle 620ml","05010038462409","COBRA","Food Cupboard","World Foods","South Asian","South Asian Beer & Lager","4.6","74.1"
"ID_978","Diet Coke 2L","Diet Coke 2L","05449000053909","Coca-Cola","Drinks","Fizzy & Soft Drinks","Cola","Diet Cola & Sugar Free Cola","3.5","100.0"
"ID_979","Coca-Cola Original Taste 500ml","Coca-Cola Original Taste 500ml","05000112588408","Coca-Cola","Drinks","On The Go Drinks","Fizzy & Soft Drinks","Fizzy & Soft Drinks","5.0","100.0"
