"UID","name","matched_name","barcode","brand","category_1","category_2","category_3","category_4","rating","match_score"
"ID_1218","Simple Kind To Skin Moisturising Handwash 250Ml","Simple Gentle Care Kind To Skin Antibacterial Handwash 250ml","08712561847179","SIMPLE","Health & Beauty","Shower, Bath & Hand Hygiene","Handwash","Antibacterial Handwash","3.7","87.0"
"ID_1219","Cadbury Brunch Oats Raisin Chocolate Cereal Bar 5 Pack 160g","Cadbury Brunch Raisin Milk Chocolate Cereal Bars 5 x 28g","07622202219306","CADBURY","Food Cupboard","Biscuits & Cereal Bars","Cereal Bars & Breakfast Bars","Treat & Cereal Bars","2.2","90.8"
"ID_1220","Always Ultra Size 1 Normal With Wings Sanitary Towels 13 Pack","Always Ultra Day Sanitary Towels Size 1 Normal with Wings 13 Pack","08006540584040","ALWAYS","Health & Beauty","Women's Toiletries","Period Products & Intimate Care","Period Pads","4.7","95.4"
"ID_1221","Tesco Green Beans 220G","Tesco Green Beans 220G","00000003471364","TESCO","Fresh Food","Fresh Vegetables & Fresh Flowers","Peas, Beans, Sweetcorn & Asparagus","Beans","2.2","100.0"
"ID_1222","Tesco British Lincolnshire Sausages 8 Pack 454G","Tesco British Lincolnshire Sausages 8 Pack 454G","05051277937280","TESCO","Fresh Food","Fresh Meat & Poultry","Sausages","Pork Sausages & Chipolatas","3.5","100.0"
"ID_1223","Tesco Citrus Antibacterial Wipes 120S","Tesco Citrus Antibacterial Wipes 120S","05052909842125","TESCO","Household","Cleaning","Cleaning & Antibacterial Wipes","Antibacterial Wipes","2.7","100.0"
"ID_1224","Tesco Beef Lean Steak Mince 5% Fat 750G","Tesco Lean Beef Steak Mince 5% Fat 750g","05053526954062","TESCO","Fresh Food","Fresh Meat & Poultry","Mince & Meatballs","Beef Mince & Meatballs","3.4","99.7"
"ID_1225","Tesco 50% Less Fat Creme Fraiche 300Ml","Tesco 50% Less Fat Creme Fraiche 300Ml","05051622920516","TESCO","Fresh Food","Milk, Butter & Eggs","Fresh Cream & Custard","Crème Fraiche","4.5","100.0"
"ID_1226","Blossomsoft Toilet Tissue White 24 Rolls","Cushelle Quilted Toilet Tissue 24 rolls","07322541173498","CUSHELLE","Household","Toilet Roll","16 Roll +","16+ Roll Toilet Roll","4.8","83.0"
"ID_1227","Carex Handwash Moisturiser Plus 250Ml+ 33% Extra Free","Carex Handwash Moisture Plus 250Ml","05000101959509","CAREX","Health & Beauty","Shower, Bath & Hand Hygiene","Handwash","Antibacterial Handwash","2.6","89.4"
"ID_1228","Tesco Curly Kale 180G","Tesco Curly Kale 180G","00000003285749","TESCO","Fresh Food","Fresh Vegetables & Fresh Flowers","Spinach, Cabbages & Greens","Greens & Kale","2.9","100.0"
"ID_1229","Tesco Sweet Potatoes 1Kg","Tesco Sweet Potatoes 1Kg","00000003314500","TESCO","Fresh Food","Fresh Vegetables & Fresh Flowers","Potatoes & Sweet Potatoes","Sweet Potato","4.4","100.0"
"ID_1230","Tesco Beautifully Balanced Greek Inspired Chicken & Feta Sandwich","Tesco Coronation Chicken Sandwich Filler 423g","05059697764455","TESCO","Fresh Food","Fresh Salad, Coleslaw & Sandwich Fillers","Sandwich Fillers","Sandwich Fillers","3.9","72.4"
"ID_1231","Bonjela 15G","Bonjela Adult Ulcer Gel (Sugar Free) 15g","05000158062139","BONJELA","Health & Beauty","Medicine","Ear Drops, Mouth Ulcers & Cold Sore Relief","Mouth Ulcer Gels","3.5","56.6"
"ID_1232","Tesco British Chicken Breast Portions 650G","Tesco British Chicken Breast Portions 650G","05057008546325","TESCO","Fresh Food","Fresh Meat & Poultry","Fresh Chicken","Chicken Breast Fillet","2.4","100.0"
"ID_1233","Tesco Whole Wheat Fusilli Pasta 500G","Tesco Whole Wheat Fusilli Pasta 500G","05000119319906","TESCO","Food Cupboard","Dried Pasta, Rice, Noodles & Cous Cous","Wholewheat, Organic & Free From","Wholewheat & Organic Pasta","4.7","100.0"
"ID_1234","Tesco Milk Chocolate Digestive Biscuits 300G","Tesco Milk Chocolate Digestive Biscuits 300G","05000119146472","TESCO","Food Cupboard","Biscuits & Cereal Bars","Chocolate Biscuits & Jaffa Cakes","Chocolate Digestives & Oat Biscuits","4.3","100.0"
"ID_1235","Tesco Ripe Bananas 5 Pack","Tesco Ripe Bananas 5 Pack","00000010001875","TESCO","Fresh Food","Fresh Fruit","Bananas","Bananas","2.4","100.0"
"ID_1236","Skinny Crunch Light Salted Caramel 5X19g","Skinny Crunch Light Salted Caramel 5X19g","05056315500891","SKINNY","Food Cupboard","Biscuits & Cereal Bars","Cereal Bars & Breakfast Bars","Treat & Cereal Bars","4.7","100.0"
"ID_1237","Ss22 F&F Tights 80 Denier Opaque Tigh Black M","F&F Home Bedding Black Check Duvet Set Single","05059697751950","F&F HOME","Home & Ents","F&F Home","Bedding","F&F Duvet Covers & Sets","","49.3"
"ID_1238","Pizza Express La Reine Classic Pizza 290 G","Pizza Express American Pizza 250G","05024530005316","PIZZA EXPRESS","Fresh Food","Fresh Pizza, Pasta & Garlic Bread","Fresh Pizza","Tesco Finest & Premium Pizza","3.3","84.1"
"ID_1239","Tesco All-In-One Dishwasher Tablets 40S Original 680G","Tesco All-in-One Dishwasher Tablets - Original 40 Pack 680g","05059697741722","TESCO","Household","Dishwashing","Dishwasher Tablets & Powder","Dishwasher Tablets","4.0","94.7"
"ID_1240","Tesco Chicken Tomato & Basil Pasta Salad 300G","Tesco Chicken, Tomato & Basil Pasta 300g","00000003258743","TESCO","Fresh Food","Chilled Soup, Sandwiches & Salad Pots","Pasta, Salad Pots & Noodle Pots","Pasta Salads","3.2","90.8"
"ID_1241","Diet Coke 330Ml","Diet Coke 30 x 330ml","05000112572933","Coca-Cola","Drinks","Fizzy & Soft Drinks","Cola","Diet Cola & Sugar Free Cola","","97.6"
"ID_1242","Tesco Finest 2 Battered Haddock & Tartare Sauce F/Cakes 315G","Tesco Finest Tartare Sauce 175G","05053947608667","TESCO FINEST","Food Cupboard","Table Sauces, Olives, Pickles & Chutney","Condiments, Worcestershire & Soy Sauce","Tartare Sauce","3.1","73.3"
"ID_1243","Tesco 12 Pork Sausages 681G","Tesco 12 Pork Sausages 681G","05052003509573","TESCO","Fresh Food","Fresh Meat & Poultry","Sausages","Pork Sausages & Chipolatas","4.2","100.0"
"ID_1244","Tesco Reduced Fat Salad Cheese 200G","Tesco Reduced Fat Salad Cheese 200G","05051790387043","TESCO","Fresh Food","Cheese","Specialty & Continental Cheese","Feta & Goats Cheese","4.2","100.0"
"ID_1245","Pritt Stick 43G","Pritt Stick 43G","00000096010242","PRITT","Home & Ents","Stationery, Arts & Crafts","Back To School","Glue Sticks","4.8","100.0"
"ID_1246","Dove Silk Glow Body Wash Shower Gel 450ml","Dove Creamy Indulge Body Wash Shower Gel 450 ml","08720181608407","DOVE","Health & Beauty","Shower, Bath & Hand Hygiene","Shower","Shower Gel & Body Wash","4.8","85.3"
"ID_1247","Tesco 30% Reduced Fat Mature Cheese 400G","Tesco 30% Reduced Fat Mature Cheese 400G","05057753919535","TESCO","Fresh Food","Cheese","Cheddar Cheese","Mature Cheddar Cheese","3.3","100.0"
"ID_1248","Deli Kitchen 4 Sliced Focaccia 360G","Deli Kitchen Greek Style Plain Flatbreads 4 Pack 320g","05012121004336","DELI KITCHEN","Bakery","Wraps, Pittas, Naan & Thins","Wraps","Wraps","4.6","64.7"
"ID_1249","Tesco 2 Breaded Chicken Breast Fillets 350G","Tesco Chicken Breast Fillets 320g","05063445799132","TESCO","Fresh Food","Fresh Meat & Poultry","Fresh Chicken","Chicken Breast Fillet","","92.4"
"ID_1250","Tesco Pure Vegetable Oil 1L","Tesco Pure Vegetable Oil 1L","05000119809902","TESCO","Food Cupboard","Cooking Ingredients","Oils & Cooking Fats","Vegetable & Sunflower Oil","3.3","100.0"
"ID_1251","Lipton Ice Tea Peach Bottle 1.25L","Lipton Ice Tea - Peach 1.25L","04060800168344","LIPTON","Drinks","Fizzy & Soft Drinks","Still Flavoured Drinks","Still Flavoured Drinks","4.9","91.9"
"ID_1252","Dr.Oetker Bicarbonate Soda 200G","Dr.Oetker Bicarbonate Soda 200G","05000254019068","DR. OETKER","Food Cupboard","Home Baking & Sugar","Baking Aids & Ingredients","Bicarbonate of Soda & Baking Powder","4.7","100.0"
"ID_1253","Sarsons Distilled Malt Vinegar 568Ml","Sarsons Distilled Malt Vinegar 568Ml","05060336500242","SARSONS","Food Cupboard","Cooking Ingredients","Vinegars","Malt Vinegar","4.0","100.0"
"ID_1254","Robinsons Orange Squash N/A/S1.5L(1L+50%","Robinsons Double Strength Orange No Added Sugar Squash 1.75L ","05010102114135","ROBINSONS","Drinks","Squash & Cordial","Squash","Orange Squash","4.5","82.8"
"ID_1255","I Heart Prosecco 75Cl","I Heart Prosecco 75Cl","05060215330779","I HEART","Drinks","Wine","Prosecco, Champagne & Sparkling Wine","Prosecco","4.2","100.0"
"ID_1256","Papersalad Birthday Card Happy Birthday Pink Gin","Papersalad Birthday Card Happy Birthday To You Blank","05060720804765","PAPER SALAD","Home & Ents","Greeting Cards","Birthday Cards","Birthday Cards","","78.3"
"ID_1257","Sensations Thai Sweet Chilli Crisps 150G","Tesco Finest Thai Inspired Sweet Chilli Crisps 150G","05059697768026","TESCO FINEST","Food Cupboard","Crisps, Snacks, Nuts & Popcorn","Sharing Crisps & Snacks","Premium & Hand Cooked Sharing Crisps","3.6","86.0"
"ID_1258","Philadelphia Garlic & Herbs Soft Cream Cheese 165G","Philadelphia Garlic & Herbs Soft Cream Cheese 165G","07622201694777","PHILADELPHIA","Fresh Food","Cheese","Soft & Spreadable Cheese","Soft Cheese & Cream Cheese","4.5","100.0"
"ID_1259","Kellogg's Coco Pops 480G","Kellogg's Coco Pops Cereal 650G","05059319024479","KELLOGG'S","Food Cupboard","Cereals","Chocolate Cereal","Chocolate Rice Snaps Cereal","3.4","88.2"
"ID_1260","Creamfields Lighter Mature Cheese 400G","Creamfields Lighter Mature Cheese 400G","05057967013883","CREAMFIELDS","Fresh Food","Cheese","Cheddar Cheese","Mature Cheddar Cheese","3.2","100.0"
"ID_1261","Tesco Brown Onions Minimum 3 Pack 385G","Tesco Brown Onions Minimum 3 Pack 385G","00000003243176","TESCO","Fresh Food","Fresh Vegetables & Fresh Flowers","Onions & Leeks","Brown Onions","2.6","100.0"
"ID_1262","Large Pink Lady Apples Loose Class 1","Large Pink Lady Apples Loose Class 1","00260950000000","TESCO","Fresh Food","Fresh Fruit","Apples & Pears","Pink & Red Apples","3.5","100.0"
"ID_1263","Whitworths Banana Chips 175G","Whitworths Banana Chips 150G","05000234054478","WHITWORTHS","Food Cupboard","Dried Fruit, Nuts, Nutrient Powders & Seeds","Dried Fruit","Dried Fruit","2.7","97.3"
"ID_1264","Rowntree's Fruit Pastilles Sweets Sharing Bag 143g","Rowntree's Fruit Pastilles Sweets Sharing Bag 143g","07613287228338","ROWNTREES","Food Cupboard","Chocolate, Sweets, Mints & Chewing Gum","Jelly & Chewy Sweets","Jelly & Chewy Sweets","3.0","100.0"
"ID_1265","Tesco Toastie White Bread Thick 800G","Tesco White Toastie Bread Thick Sliced 800g","05057545619483","TESCO","Bakery","Bread & Rolls","White Bread","White Bread","3.8","97.2"
"ID_1266","Tesco All Butter Pain Au Chocolat 2 Pack","Tesco All Butter Pain Au Chocolat 4 Pack","05000436733607","TESCO","Bakery","Croissants, Brioche & Pastries","Pain au Chocolat","Pain au Chocolat","4.4","98.5"
"ID_1267","Franco Manca Quattro Formaggi & Balsamic Glaze Pizza 454G","Franco Manca Greek Inspired Chicken Gyros Pizza with Garlic & Mint 470g","05060005422226","FRANCO MANCA","Fresh Food","Fresh Pizza, Pasta & Garlic Bread","Fresh Pizza","Pepperoni & Meat Pizza","2.3","76.8"
"ID_1268","Tesco Cooked And Peeled King Prawns 160G","Tesco Cooked And Peeled King Prawns 150G","05057008546028","TESCO","Fresh Food","Chilled Fish & Seafood","Prawns & Seafood","Prawns","3.8","99.0"
"ID_1269","Tesco British Double Cream 150Ml","Tesco British Double Cream 150Ml","05051399456546","TESCO","Fresh Food","Milk, Butter & Eggs","Fresh Cream & Custard","Double & Extra Thick Cream","3.9","100.0"
"ID_1270","Tesco Carrots 1Kg","Tesco Carrots 1Kg","00000003335215","TESCO","Fresh Food","Fresh Vegetables & Fresh Flowers","Carrots & Root Vegetables","Carrots","2.0","100.0"
"ID_1271","Seedless Grapes Pack 400G +25% Free Class1","Tesco Seedless Grape Selection Pack 500G","00000010066126","TESCO","Fresh Food","Fresh Fruit","Grapes","Seedless Mixed Grapes","2.6","79.4"
"ID_1272","Tesco Grated Parmigiano Reggiano 100G","Tesco Grated Parmigiano Reggiano 100G","05010204699462","TESCO","Fresh Food","Cheese","Specialty & Continental Cheese","Parmesan & Pecorino","4.2","100.0"
"ID_1273","Bisto Favourite Gravy Granules 190G","Bisto Favourite Gravy Granules 190G","05000354919527","BISTO","Food Cupboard","Cooking Ingredients","Gravy, Stuffing & Breadcrumbs","Beef Gravy Granules","4.4","100.0"
"ID_1274","Tesco Celery","Tesco Celery","00000003488805","TESCO","Fresh Food","Fresh Salad, Coleslaw & Sandwich Fillers","Celery","Celery","3.6","100.0"
"ID_1275","Tesco Lasagne Pasta 500G","Tesco Lasagne Pasta 500G","05000436101925","TESCO","Food Cupboard","Dried Pasta, Rice, Noodles & Cous Cous","Pasta & Spaghetti","Pasta - Lasagne Sheets","3.3","100.0"
"ID_1276","Tesco Scented Candle Vanilla & Honey 95G","TESCO RHUBARB CANDLE 95G","05063249351987","TESCO HOME","Home & Ents","Home Accessories","Candles","Scented Candles","","74.8"
"ID_1277","Tesco Carrot Batons 400G","Tesco Carrot Batons 400G","05059697777264","TESCO","Fresh Food","Fresh Vegetables & Fresh Flowers","Prepared Vegetables","Prepared Single Vegetables","2.6","100.0"
"ID_1278","Tesco British Unsalted Butter 250G","Tesco British Unsalted Butter 250G","05054775188321","TESCO","Fresh Food","Milk, Butter & Eggs","Butters, Spreads & Margarine","Block Butter","4.4","100.0"
"ID_1279","Tesco Pasta Bake Creamy Tomato & Herb 500G","Tesco Creamy Tomato & Herb Pasta Bake Sauce 500g","05051898805821","TESCO","Food Cupboard","Cooking Sauces, Meal Kits & Sides","Italian","Pasta Bake Sauce - Pasta Sauce","3.3","95.6"
"ID_1280","New York Bakery Plain Bagels 5 Pack","New York Bakery Co The Original Plain Bagels 5 Pack","05020364010113","HOT BAGEL CO","Bakery","Bread & Rolls","Bagels","Bagels","4.4","94.8"
"ID_1281","Tesco Crushed Chillies 28G","Tesco Crushed Chillies 28G","05031021125651","TESCO","Food Cupboard","Cooking Ingredients","Seasoning, Herbs & Spices","Chilli Powder & Flakes","4.5","100.0"
"ID_1282","Tesco Mint 30G","Tesco Mint 30G","00000010065112","TESCO","Fresh Food","Fresh Salad, Coleslaw & Sandwich Fillers","Fresh Chillies, Herbs, Garlic & Ginger","Fresh Cut Herbs","4.0","100.0"
"ID_1283","Psa Male Millimetre Psajj1855te","Tesco 5W-30 Fully Synthetic Psa Motor Oil 2L","05059697744860","TESCO","Home & Ents","DIY & Car Care","Car Care","Oil and Maintenance Liquids","","53.3"
"ID_1284","Kellogg's Rice Krispies Squares Marshmallow Snack Bars 4x28g","Kellogg's Rice Krispies Squares Marshmallow Snack Bars Multipack, 4x28g","05000127730137","KELLOGG'S","Food Cupboard","Cereals","On The Go Breakfast","Breakfast Bars & Biscuits","4.7","96.6"
"ID_1285","Tesco Whole Wheat Penne Pasta 500G","Tesco Whole Wheat Spaghetti 500G","05057373964694","TESCO","Food Cupboard","Dried Pasta, Rice, Noodles & Cous Cous","Wholewheat, Organic & Free From","Wholewheat & Organic Pasta","4.7","91.0"
"ID_1286","Always Ultra Size 4 Secure Night With Wings Sanitary Towels 8Pk","Always Ultra Secure Night Size 4 Sanitary Towels with Wings 8 Pack","08006540588505","ALWAYS","Health & Beauty","Women's Toiletries","Period Products & Intimate Care","Period Pads","4.7","93.0"
"ID_1287","Always Ultra Size 3 Night With Wings Sanitary Towels 9 Pack","Always Ultra Size 3 Night With Wings Sanitary Towels 9 Pack","08006540584200","ALWAYS","Health & Beauty","Women's Toiletries","Period Products & Intimate Care","Night Time Period Protection","4.7","100.0"
"ID_1288","Always Ultra Size 2 Long With Wings Sanitary Towels 11 Pack","Always Ultra Size 2 Long With Wings Sanitary Towels 11 Pack","08006540584101","ALWAYS","Health & Beauty","Women's Toiletries","Period Products & Intimate Care","Period Pads","4.7","100.0"
"ID_1289","Tesco Iceberg Lettuce 200G","Tesco Iceberg Lettuce 200G","05059697752056","TESCO","Fresh Food","Fresh Salad, Coleslaw & Sandwich Fillers","Lettuce & Salad bags","Salad Bags","2.7","100.0"
"ID_1290","Tesco Strawberry Pencils 75G","Tesco Strawberry Pencils 75G","05000358628821","TESCO","Food Cupboard","Chocolate, Sweets, Mints & Chewing Gum","Kids Sweets","Sweets","3.1","100.0"
"ID_1291","Theos Ready Rolled Filo Pastry 250 G","Theos Ready Rolled Filo Pastry 250 G","09310683000077","THEOS PASTRY","Fresh Food","Milk, Butter & Eggs","Baking & Cooking","Shortcrust Pastry & Filo Pastry","3.5","100.0"
"ID_1292","Cathedral City Extra Mature Cheddar Cheese 550 G","Cathedral City Extra Mature Cheddar Cheese 550 G","05000295148154","CATHEDRAL CITY","Fresh Food","Cheese","Cheddar Cheese","Extra Mature & Vintage Cheddar Cheese","4.0","100.0"
"ID_1293","Tesco 2 British Chicken Breast Fillets 300G","Tesco British Chicken Breast Fillets 950G","05054775750283","TESCO","Fresh Food","Fresh Meat & Poultry","Fresh Chicken","Chicken Breast Fillet","2.2","96.4"
"ID_1294","Tesco Italian Seasoning 18G ..","Tesco Italian Seasoning 18G ..","00000003283226","TESCO","Food Cupboard","Cooking Ingredients","Seasoning, Herbs & Spices","Spices","4.8","100.0"
"ID_1295","Tesco Fajita Seasoning 30G","Tesco Fajita Seasoning 30G","05057008002975","TESCO","Food Cupboard","Cooking Sauces, Meal Kits & Sides","Mexican & Latin American","Mexican & Latin American Seasoning Mix","4.2","100.0"
"ID_1296","Tesco Sour Cream Topping 280G","Tesco Sour Cream Topping 280G","05052909354970","TESCO","Food Cupboard","Cooking Sauces, Meal Kits & Sides","Mexican & Latin American","Salsa, Sour Cream & Guacamole","4.0","100.0"
"ID_1297","Muller Rice Low Fat Original Pudding 170G","Muller Rice Original Low Fat Dessert 170G","04025500278113","Müller","Fresh Food","Yogurts","Indulgent Yogurts, Corners & Rice Pudding","Rice Pudding","4.7","89.6"
"ID_1298","Mud House Chile Sauvignon Blanc Rose 750Ml","Mud House Chilean Sauvignon Blanc Wine 75cl","05010134919876","MUD HOUSE","Drinks","Wine","White Wine","Sauvignon Blanc","4.1","62.4"
"ID_1299","Premium Seasonal Duo","Seasonal christmas (kitchen towel)","05063169044587","Andrew Lee","Marketplace","Cook & Dine","Kitchen Accessories","Napkins, Tea Towels & Oven Gloves","","51.3"
"ID_1300","Gordon's Pink Gin & Tonic Can 5% Vol 250ml ","Gordon's Pink Gin & Tonic Can 5% Vol 250ml ","05000289929899","GORDON'S","Drinks","Ready To Drink Wine & Spirits","Ready to Drink Premixed Spirits & Cocktails","Premixed Spirits & Mixer Cans","3.7","100.0"
"ID_1301","Kopparberg Gin & Lemonade Strawberry & Lime 250ml","Kopparberg Gin & Lemonade Strawberry & Lime 250ml","07393714008503","KOPPARBERG","Drinks","Ready To Drink Wine & Spirits","Ready to Drink Premixed Spirits & Cocktails","Gin Based Premixed Drinks","4.9","100.0"
"ID_1302","Tesco Italian Tomato Passata 500G","Tesco Italian Tomato Passata 500G","05000119560445","TESCO","Food Cupboard","Tins, Cans & Packets","Tomatoes, Passata & Puree","Tomato Passata","2.7","100.0"
"ID_1303","Surf Tropical Lily 3In1 Washing Capsules 32 Wash 678G","Surf 3 in1 Tropical Lily Washing Capsules 51 Washes 882.3g","08720181511387","SURF","Household","Laundry","Washing Capsules & Pods","Scented Washing Capsules & Pods","","93.7"
"ID_1304","Tesco Finest 2 Salmon Spinach & Lemon Fishcakes 290G","Tesco Finest 2 Salmon, Spinach & Lemon Fishcakes 290g","05054775579068","TESCO FINEST","Fresh Food","Chilled Fish & Seafood","Fishcakes & Fish Fingers","Chilled Fishcakes","3.2","99.1"
"ID_1305","Sanex Expert Skin Health+ Hypoallergenic Shower Gel 515Ml","Sanex Expert Skin Health+ Hypoallergenic Shower Gel Body Wash 450ml","08718951645103","SANEX","Health & Beauty","Shower, Bath & Hand Hygiene","Shower","Shower Gel & Body Wash","4.6","93.9"
"ID_1306","Arla Protein Raspberry Yogurt 200G","Arla Protein Yogurt - Raspberry 200g","06413300018035","ARLA","Fresh Food","Yogurts","Low Fat & Fat Free Yogurt","Low Fat Yoghurts","4.2","99.1"
"ID_1307","Tesco Fine Beans 200G","Tesco Fine Beans 200G","00000003236925","TESCO","Fresh Food","Fresh Vegetables & Fresh Flowers","Peas, Beans, Sweetcorn & Asparagus","Beans","2.1","100.0"
"ID_1308","Tesco Finest 2 Cod & Parsley Fishcakes 290G","Tesco Finest 2 Cod & Parsley Fishcakes 290G","05054775579167","TESCO FINEST","Fresh Food","Chilled Fish & Seafood","Fishcakes & Fish Fingers","Chilled Fishcakes","2.9","100.0"
"ID_1309","Tesco Chicken & Avocado Sandwich","Tesco Chicken & Stuffing Sandwich","00000003035498","TESCO","Fresh Food","Chilled Soup, Sandwiches & Salad Pots","Sandwiches, Wraps & Sushi","Sandwiches","3.2","85.1"
"ID_1310","Canti Prosecco Spumante 75Cl","Canti Prosecco Spumante 75Cl","08005415046447","CANTI","Drinks","Wine","Prosecco, Champagne & Sparkling Wine","Prosecco","4.1","100.0"
"ID_1311","Tesco Large Chocolate Cake","Tesco Happy Birthday Chocolate Cake","05018374322906","TESCO","Bakery","Cakes, Cake Bars, Slices & Pies","Birthday & Celebration Cakes","Occasion & Birthday Cakes","4.5","97.3"
"ID_1312","Cadbury Fingers Mini Chocolate Biscuits 6 Pack Multipack 115.8g","Cadbury Mini Fingers Milk Chocolate Biscuits Multipack, 6 pack 115.8g","07622210737236","CADBURY","Food Cupboard","Biscuits & Cereal Bars","Chocolate Biscuit Bars & Mini Biscuits","Mini Biscuits","2.9","96.4"
"ID_1313","Gosh Beetroot Falafel With Red Pepper 300G","Gosh Beetroot Falafel Red Pepper & Chilli 266G","05036829756724","GOSH","Fresh Food","Chilled Vegetarian & Vegan","Deli Slices, Ready to Eat Pieces & Falafels","Vegan Slices & Pieces","4.0","90.5"
"ID_1314","HP Fruity Brown Sauce Top Down 470g","HP Fruity Brown Sauce Top Down 470g","05000111047340","HP","Food Cupboard","Table Sauces, Olives, Pickles & Chutney","Brown Sauce","Brown Sauce","4.6","100.0"
"ID_1315","Tesco Blueberries 150G+100% X/Free","Tesco Blueberries 150G","00000003257005","TESCO","Fresh Food","Fresh Fruit","Berries & Cherries","Blueberries","3.8","90.8"
"ID_1316","Tesco Raspberries 150G","Tesco Raspberries 150G","00000003257067","TESCO","Fresh Food","Fresh Fruit","Berries & Cherries","Raspberries","3.3","100.0"
"ID_1317","Tesco Organic Balsamic Vinegar Of Modena 250Ml","Mazzetti Organic Balsamic Vinegar Of Modena 250Ml","08002461910609","MAZZETTI","Food Cupboard","Cooking Ingredients","Vinegars","Balsamic Vinegar & Balsamic Glaze","4.8","89.5"
"ID_1318","Tesco Red Onions Loose","Tesco Red Onions Loose","00268670000000","TESCO","Fresh Food","Fresh Vegetables & Fresh Flowers","Onions & Leeks","Pink Onions & Red Onions","3.3","100.0"
"ID_1319","Tesco Worcester Sauce 150Ml","Tesco Worcester Sauce 150Ml","05057373870810","TESCO","Food Cupboard","Table Sauces, Olives, Pickles & Chutney","Condiments, Worcestershire & Soy Sauce","Worcestershire Sauce & Soy Sauce","3.5","100.0"
"ID_1320","Amoy Dark Soy Sauce 150Ml","Amoy Dark Soy Sauce 150Ml","05000111044202","AMOY","Food Cupboard","Table Sauces, Olives, Pickles & Chutney","Condiments, Worcestershire & Soy Sauce","Worcestershire Sauce & Soy Sauce","4.7","100.0"
"ID_1321","Cathedral City Mature Cheddar Cheese 550 G","Cathedral City Mature Cheddar Cheese 550 G","05000295145054","CATHEDRAL CITY","Fresh Food","Cheese","Cheddar Cheese","Mature Cheddar Cheese","3.7","100.0"
"ID_1322","Carex Advanced Protect Moisturising Hand Wash 250Ml","Carex Handwash Sensitive 250Ml","05000101799556","CAREX","Health & Beauty","Shower, Bath & Hand Hygiene","Handwash","Antibacterial Handwash","3.7","83.7"
"ID_1323","Tesco Sink & Drain Unblocker 500Ml","Tesco Sink & Drain Unblocker 500Ml","05053947394508","TESCO","Household","Cleaning","Sink & Drain Unblockers","Sink & Drain Unblockers","4.7","100.0"
"ID_1324","Tesco British Skimmed Milk 1.136L, 2 Pints","Tesco British Skimmed Milk 1.136L, 2 Pints","05000436338901","TESCO","Fresh Food","Milk, Butter & Eggs","Milk","Skimmed Milk","3.6","100.0"
"ID_1325","Trio Of Olive Bloomer","Tesco Trio Of Olives 300G","05059697266805","TESCO","Fresh Food","Cooked Meats, Antipasti & Dips","Olives, Antipasti & Tapas","Olives","4.5","87.7"
"ID_1326","Maltesers Kingsize 58.5G","Maltesers Kingsize 58.5G","05000159024518","MALTESERS","Food Cupboard","Chocolate, Sweets, Mints & Chewing Gum","Single Chocolate Bars & Sweets","Chocolate Single Bars & Bags","5.0","100.0"
"ID_1327","Sure Women Bright Antiperspirant Deodorant 250Ml","Sure Women Uplifting & Fresh 72h Nonstop Protection Antiperspirant Deodorant 250ml","08720181197239","SURE","Health & Beauty","Women's Toiletries","Deodorants","Womens Antiperspirant","4.6","91.1"
"ID_1328","Tesco Turkey Trimmings Wrap","Tesco Turkey & Trimmings Sandwich","00000003278338","TESCO","Fresh Food","Chilled Soup, Sandwiches & Salad Pots","Lunch Meal Deals","£4 Meal Deal Mains","3.5","80.5"
"ID_1329","Colgate Triple Action Toothpaste 100Ml","Colgate Triple Action Toothpaste 75Ml","08718951564862","COLGATE","Health & Beauty","Toothpaste, Mouthwash & Toothbrush","Toothpaste","Regular Toothpaste","3.6","99.1"
"ID_1330","Tesco Tuna Chunks In Brine 145G","Tesco Tuna Chunks In Brine 145G","00000003341179","TESCO","Food Cupboard","Tins, Cans & Packets","Tinned Fish & Seafood","Tinned Tuna In Brine","4.4","100.0"
"ID_1331","Tesco Reduced Sugar And Salt Baked Beans In Tomato Sauce 420G","Tesco Reduced Sugar And Salt Baked Beans In Tomato Sauce 420G","05057753934996","TESCO","Food Cupboard","Tins, Cans & Packets","Baked Beans","Tinned Baked Beans","4.1","100.0"
"ID_1332","Gillette Venus Extra Smooth Women's Razor","Gillette Venus Extra Smooth Women's Razor","07702018323012","GILLETTE VENUS","Health & Beauty","Women's Toiletries","Shaving & Hair Removal","Womens Razors & Razor Blades","1.0","100.0"
"ID_1333","Tesco Reduced Fat Green Pesto 190G","Tesco Reduced Fat Green Pesto 190G","05052909736189","TESCO","Food Cupboard","Cooking Sauces, Meal Kits & Sides","Italian","Pesto","3.8","100.0"
"ID_1334","Tesco Handy Sudoku Collec","Bamboo Sudoku Puzzle Game","00850013539529","University Games","Marketplace","Toys","Puzzles","Sudoku Puzzles","","56.0"
"ID_1335","Green & Black's Organic 85% Dark Chocolate Bar 90g","Green & Black's Organic 85% Dark Chocolate Bar 90g","07622210584724","GREEN & BLACK'S","Food Cupboard","Chocolate, Sweets, Mints & Chewing Gum","Dark Chocolate","Luxury Block Chocolate Bars","4.4","100.0"
"ID_1336","Granulated Sugar 1Kg","Granulated Sugar 1Kg","05010067301502","SILVER SPOON","Food Cupboard","Home Baking & Sugar","Sugar","Granulated Sugar & Jam Sugar","4.0","100.0"
"ID_1337","Tesco Tomato Puree 200G","Cirio Tomato Puree 140G","08000320110191","CIRIO","Food Cupboard","Tins, Cans & Packets","Tomatoes, Passata & Puree","Tomato Puree","4.8","84.7"
