"UID","name","matched_name","barcode","brand","category_1","category_2","category_3","category_4","rating","match_score"
"ID_1","Hellmann's Light Mayonnaise Squeezy 650Ml","Hellmann's Light Mayonnaise Squeezy 750ml","08718114724430","HELLMANN'S","Food Cupboard","Table Sauces, Olives, Pickles & Chutney","Mayonnaise","Light & Low Fat Mayonnaise","4.5","99.4"
"ID_2","Express Tesco Egg Custard Tart 2 Pack","Tesco Egg Custard Tarts 2 Pack","05018374207609","TESCO","Fresh Food","Chilled Desserts","Fresh Cream Cakes & Tarts","Tarts","3.0","96.1"
"ID_3","Tesco Loose Red Peppers(C)","Tesco Loose Red Peppers(C)","00000010057520","TESCO","Fresh Food","Fresh Salad, Coleslaw & Sandwich Fillers","Peppers","Peppers","5.0","93.2"
"ID_4","Tesco Sweetheart Cabbage (C)","Tesco Sweetheart Cabbage Each","00000010021866","TESCO","Fresh Food","Fresh Vegetables & Fresh Flowers","Spinach, Cabbages & Greens","Cabbages","3.1","92.5"
"ID_5","Tesco Carrot 500G (C)","Tesco Carrot 500G (C)","00000003272657","TESCO","Fresh Food","Fresh Vegetables & Fresh Flowers","Carrots & Root Vegetables","Carrots","3.0","90.1"
"ID_6","Tesco British Chicken Breast Mini Fillets 400G","Tesco British Chicken Breast Mini Fillets 400G","05057753931001","TESCO","Fresh Food","Fresh Meat & Poultry","Fresh Chicken","Chicken Breast Fillet","3.2","100.0"
"ID_7","Tesco Brown Onion Each (C)","Tesco Organic Brown Onions 750G","00000010112489","TESCO ORGANIC","Fresh Food","Fresh Vegetables & Fresh Flowers","Onions & Leeks","Brown Onions","3.0","82.7"
"ID_8","Tesco Finest Wholemeal Loaf 800G","Tesco Finest Wholemeal Loaf 800G","05057545918791","TESCO FINEST","Bakery","Bread & Rolls","Brown & Wholemeal Bread","Brown & Wholemeal Bread","3.7","100.0"
"ID_9","Tesco Sweet Chilli Houmous 182G","Tesco Sweet Chilli Houmous 182G","05053526262419","TESCO","Fresh Food","Cooked Meats, Antipasti & Dips","Houmous & Dips","Houmous","3.8","100.0"
"ID_10","Tesco Red Kidney Beans In Water 400G","Tesco Organic Red Kidney Beans In Water 400G","05057753898397","TESCO","Food Cupboard","Tins, Cans & Packets","Pulses, Lentils & Beans","Tinned Kidney Beans","4.8","96.0"
"ID_11","Tesco Conference Pear Minimum 4 Pack","Tesco Ready to Eat Conference Pears 4 Pack","00000003249550","TESCO","Fresh Food","Fresh Fruit","Apples & Pears","Ready to Eat Pears","4.2","83.8"
"ID_12","Tesco Salad Tomatoes 360G (C)","Tesco Salad Tomatoes 650G","00000003274392","TESCO","Fresh Food","Fresh Salad, Coleslaw & Sandwich Fillers","Tomatoes","Tomatoes","2.6","95.8"
"ID_13","Tesco Cream Of Tomato Soup 400G","Tesco Cream Of Tomato Soup 400G","05000436960065","TESCO","Food Cupboard","Tins, Cans & Packets","Tinned & Packet Soup","Everyday Tinned Soup","4.2","100.0"
"ID_14","Tesco Chickpeas In Water 400G","Napolina Chickpeas In Water 400g","05000232844217","NAPOLINA","Food Cupboard","Tins, Cans & Packets","Pulses, Lentils & Beans","Tinned Chickpeas","3.3","77.6"
"ID_15","Tesco Closed Cup Mushrooms 300G (C)","Tesco Closed Cup Mushrooms 400G","00000003478295","TESCO","Fresh Food","Fresh Vegetables & Fresh Flowers","Mushrooms","White & Button Mushrooms","3.0","98.2"
"ID_16","Tesco Taramasalata 200G (C)","Tesco Taramasalata Dip 200G","00000010065884","TESCO","Fresh Food","Cooked Meats, Antipasti & Dips","Houmous & Dips","Creamy Dips & Tzatziki","2.1","88.8"
"ID_17","Tesco Garlic Twin Pack (C)","Tesco Garlic Twin Pack (C)","00000010080856","TESCO","Fresh Food","Fresh Vegetables & Fresh Flowers","Fresh Chillies, Herbs, Garlic & Ginger","Garlic Cloves","5.0","91.6"
"ID_18","Tesco Maris Piper Potatoes 2Kg","Tesco Maris Piper Potatoes 2Kg","00000003326336","TESCO","Fresh Food","Fresh Vegetables & Fresh Flowers","Potatoes & Sweet Potatoes","All Rounder Potatoes","3.9","100.0"
"ID_19","Tesco Italian Peeled Plum Tomatoes 400G","Tesco Italian Peeled Plum Tomatoes 400G","05031021164018","TESCO","Food Cupboard","Tins, Cans & Packets","Tomatoes, Passata & Puree","Plum & Peeled Tomatoes","3.6","100.0"
"ID_20","Yorkie Raisin & Biscuit Chocolate Bar 44g","Yorkie Raisin & Biscuit Duo Chocolate Bar 66g","07613034043870","NESTLE","Food Cupboard","Chocolate, Sweets, Mints & Chewing Gum","Single Chocolate Bars & Sweets","Chocolate Single Bars & Bags","4.0","93.9"
"ID_21","San Pellegrino Sparkling Natural Mineral Water 500ml","San Pellegrino Sparkling Natural Mineral Water 500ml","08002270000515","SAN PELLEGRINO","Drinks","Water","Sparkling Water","Single Bottled Sparkling Water","5.0","100.0"
"ID_22","Tesco Plant Chef Roasted Vegetable & Pesto Wrap","Tesco Plant Chef Hoisin Wrap","00000003334768","TESCO PLANT CHEF","Fresh Food","Chilled Soup, Sandwiches & Salad Pots","Sandwiches, Wraps & Sushi","Wraps","3.1","82.9"
"ID_23","Limes Each","Tesco Limes Each","00223980000000","TESCO","Fresh Food","Fresh Fruit","Oranges, Lemons & Citrus Fruit","Limes","3.1","76.7"
"ID_24","Tesco Extra Mature Cheddar Cheese 400G","Tesco Extra Mature Cheddar Cheese 400G","05057753902384","TESCO","Fresh Food","Cheese","Cheddar Cheese","Extra Mature & Vintage Cheddar Cheese","3.7","100.0"
"ID_25","Tesco Fresh Soured Cream 142Ml","Tesco Soured Cream 300Ml","05052003444355","TESCO","Fresh Food","Milk, Butter & Eggs","Fresh Cream & Custard","Soured Cream","4.7","94.8"
"ID_26","Tesco Plant Chef Hoisin Wrap","Tesco Plant Chef Hoisin Wrap","00000003334768","TESCO PLANT CHEF","Fresh Food","Chilled Soup, Sandwiches & Salad Pots","Sandwiches, Wraps & Sushi","Wraps","3.1","100.0"
"ID_27","Walkers Baked Cheese & Onion Grab Bag Crisps 37.5g","Walkers Baked Cheese & Onion Grab Bag Crisps 37.5g","05000328774800","WALKERS","Food Cupboard","Crisps, Snacks, Nuts & Popcorn","Single Crisps & Snacks","Baked Single Crisps & Snacks","4.8","100.0"
"ID_28","Tesco Cinnamon Swirl","Tesco Cinnamon Swirl","00000003269329","TESCO","Bakery","From Our Bakery","Croissants & Pastries From Our Bakery","Single Croissants & Danish Pastries","3.0","100.0"
"ID_29","Tesco Finest Garlic & Extra Virgin Olive Oil Flatbread 200G","Tesco Finest Garlic & Extra Virgin Olive Oil Flatbread 200G","05057753939427","TESCO","Fresh Food","Fresh Pizza, Pasta & Garlic Bread","Chilled Garlic Bread & Dough Balls","Garlic Bread & Garlic Baguettes","3.5","100.0"
"ID_30","Pizza Express Slsc Sloppy Giuseppe 292G","Pizza Express Sloppy Giuseppe 292G","05051873005253","PIZZA EXPRESS","Fresh Food","Fresh Pizza, Pasta & Garlic Bread","Fresh Pizza","Pepperoni & Meat Pizza","3.5","94.6"
"ID_31","Tesco Finest Buffalo Mozzarella & Tomato Pizza 420G","Tesco Finest Buffalo Mozzarella & Tomato Pizza 420G","05057967576241","TESCO FINEST","Fresh Food","Fresh Pizza, Pasta & Garlic Bread","Fresh Pizza","Tesco Finest & Premium Pizza","3.8","100.0"
"ID_32","Tesco Wholemeal Pitta Bread 6 Pack","Tesco Wholemeal Pitta Bread 6 Pack","05000119095282","TESCO","Bakery","Wraps, Pittas, Naan & Thins","Pitta","Pitta","3.3","100.0"
"ID_33","Tesco Iceberg Lettuce Each (C)","Tesco Iceberg Lettuce Each","00000010010488","TESCO","Fresh Food","Fresh Salad, Coleslaw & Sandwich Fillers","Lettuce & Salad bags","Iceberg & Round Lettuce","2.5","100.0"
"ID_34","Tesco Red Onions Each (C)","Tesco Red Onions Each","00262800000000","TESCO","Fresh Food","Fresh Vegetables & Fresh Flowers","Onions & Leeks","Pink Onions & Red Onions","2.8","96.6"
"ID_35","Tesco Spinach 250G","Tesco Spinach 250G","00000003285732","TESCO","Fresh Food","Fresh Vegetables & Fresh Flowers","Spinach, Cabbages & Greens","Spinach","4.7","95.3"
"ID_36","Tesco British Semi Skimmed Milk 2.272L, 4 Pints","Tesco British Semi Skimmed Milk 2.272L, 4 Pints","05000436589457","TESCO","Fresh Food","Milk, Butter & Eggs","Milk","Semi-Skimmed Milk","4.0","100.0"
"ID_37","Tesco Cooked Beetroot Vacuum Pack 300G (C)","Tesco Cooked Beetroot Vacuum Pack 300G (C)","00000010052389","TESCO","Fresh Food","Fresh Salad, Coleslaw & Sandwich Fillers","Spring Onions, Radish & Beetroot","Beetroot","4.5","97.0"
"ID_38","Tesco Ground Black Pepper 25G","Tesco Ground Black Pepper 25G","05052910612007","TESCO","Food Cupboard","Cooking Ingredients","Salt & Pepper","Ground Pepper","4.8","100.0"
"ID_39","Tesco Sweet Easy Peeler 600G (C)","Tesco Sweet Easy Peelers 600g","00000010002230","TESCO","Fresh Food","Fresh Fruit","Oranges, Lemons & Citrus Fruit","Clementines & Easy Peelers","2.0","98.9"
"ID_40","Tesco Conference Each (C)","Tesco Dudhi Each","00000003222881","TESCO","Fresh Food","Fresh Vegetables & Fresh Flowers","Courgettes, Aubergines & Squash","Butternut Squash","5.0","64.5"
"ID_41","Tesco Mini Watermelon","Tesco Mini Watermelon","00000010075340","TESCO","Fresh Food","Fresh Fruit","Melons & Pineapples","Melons","3.8","100.0"
"ID_42","Ambrosia Devon Custard 400G Can","Ambrosia Devon Custard 400G","05000354800870","AMBROSIA","Food Cupboard","Desserts","Custard","Tinned Custard","4.3","95.5"
"ID_43","Tesco Greek Style Yogurt 500G","Tesco Greek Style Yogurt 500G","05000462416772","TESCO","Fresh Food","Yogurts","Natural & Greek Style Yogurts","Plain Greek Style Yoghurt","4.3","100.0"
"ID_44","Warburtons Sliced Tiger Bread 600G","Warburtons Tiger Bread Bloomer 600g","05010044003955","WARBURTONS","Bakery","Bread & Rolls","White Bread","White Bread","3.4","87.2"
"ID_45","Cucumber Whole Each (C)","Tesco Whole Cucumber Each","00000010015599","TESCO","Fresh Food","Fresh Salad, Coleslaw & Sandwich Fillers","Cucumber","Cucumber","3.2","84.4"
"ID_46","Tesco Caramelised Onion Houmous 200G (C)","Tesco Caramelised Onion Houmous 182g","05059697262357","TESCO","Fresh Food","Fresh Salad, Coleslaw & Sandwich Fillers","Houmous & Dips","Flavoured Houmous","2.3","95.4"
"ID_47","Tesco Mint 15G (C)","Tesco Mint 30G","00000010065112","TESCO","Fresh Food","Fresh Salad, Coleslaw & Sandwich Fillers","Fresh Chillies, Herbs, Garlic & Ginger","Fresh Cut Herbs","4.0","96.2"
"ID_48","Tesco 12 Indian Selection 320G","Tesco 12 Indian Selection 320G","05057753859527","TESCO","Fresh Food","Ready Meals","Indian Ready Meals","Indian Ready Meal Starters & Sides","3.0","100.0"
"ID_49","Banana Each (C)","Banana Leaves (Bath Towel)","05063169516640","Andrew Lee","Marketplace","Home Accessories","Bathroom Accessories & Towels","Bathroom Towels & Mats","","74.0"
"ID_50","Mint Birthday Card Ha Pea Birthday","Mint Birthday Card Ha Pea Birthday","00871283002209","CARLTON CARDS","Home & Ents","Greeting Cards","Birthday Cards","Birthday Cards","","100.0"
"ID_51","Condesa De Flores Cava Brut 75Cl","Condesa De Flores Cava Brut 75Cl","05059697261565","Condesa De Flores","Drinks","Wine","Prosecco, Champagne & Sparkling Wine","Cava","2.4","100.0"
"ID_52","Tesco Ripe & Ready Avocado","Tesco Ripe & Ready Medium Avocado","00000003042045","TESCO","Fresh Food","Fresh Salad, Coleslaw & Sandwich Fillers","Avocado","Ready To Eat Avocado","1.9","98.4"
"ID_53","Tesco Baby Plum Tomatoes 300G","Tesco Baby Plum Tomatoes 300G","00000003403112","TESCO","Fresh Food","Fresh Salad, Coleslaw & Sandwich Fillers","Tomatoes","Baby & Cherry Tomatoes","3.8","100.0"
"ID_54","Tesco Egg Custard Tarts 2 Pack","Tesco Egg Custard Tarts 2 Pack","05018374207609","TESCO","Fresh Food","Chilled Desserts","Fresh Cream Cakes & Tarts","Tarts","3.0","100.0"
"ID_55","Tesco Frozen Small Turkey Crown 1.5Kg","Tesco Frozen Small Turkey Crown 1.5Kg","05057008024458","TESCO","Frozen Food","Meat & Poultry","Turkey","Frozen Turkey Crown","2.2","92.4"
"ID_56","Tesco Ripen At Home Avocados 3Pack","Tesco Ripen At Home Avocados 3Pack","00000003453049","TESCO","Fresh Food","Fresh Salad, Coleslaw & Sandwich Fillers","Avocado","Ready To Eat Avocado","3.7","100.0"
"ID_57","Tesco Free Range Eggs Mixed Sized 6 Pack","Tesco Free Range Eggs Medium 6 Pack","05018374888341","TESCO","Fresh Food","Milk, Butter & Eggs","Eggs","Free Range Eggs","2.8","96.4"
"ID_58","Tesco Multiseed Batch 800G","Tesco Multiseed Batch Medium Sliced White Loaf 800g","05057545928899","TESCO","Bakery","Bread & Rolls","Seeded Bread","Seeded Bread","3.8","96.1"
"ID_59","Tesco Cantaloupe Melon Each","Tesco Cantaloupe Melon Each","00000010024423","TESCO","Fresh Food","Fresh Fruit","Melons & Pineapples","Melons","2.2","100.0"
"ID_60","Eat Natural Fruit & Nut Bar Dark Chocolate with Cranberries and Macadamias 45g","Eat Natural Fruit & Nut Bar with Dark Chocolate, Cranberries & Macadamias 40g","08000500417348","EAT NATURAL","Treats & Snacks","Biscuits & Cereal Bars","Cereal Bars & On the Go Snack Bars","Treat & Cereal Bars","","97.5"
"ID_61","Yo! Rainbow Salmon Poke 283G","Yo! Rainbow Salmon Poke 283G","05035272937469","YO!","Fresh Food","Chilled Soup, Sandwiches & Salad Pots","Lunch Meal Deals","£5.50 Meal Deal Mains","4.0","100.0"
"ID_62","Tesco Brussels Sprouts 300g","Tesco Brussels Sprouts 300g","00000003313602","TESCO","Fresh Food","Fresh Vegetables & Fresh Flowers","Spinach, Cabbages & Greens","Brussel Sprouts","2.0","100.0"
"ID_63","Tesco Healthy Living Chicken Breast Fillets 2 Pack 300G","Tesco Chicken Breast Fillets 320g","05063445799132","TESCO","Fresh Food","Fresh Meat & Poultry","Fresh Chicken","Chicken Breast Fillet","","88.6"
"ID_64","Tesco Finest Sweet & Fiery Beetroot 180G","Tesco Finest Sweet & Fiery Beetroot 180G","00000003278116","TESCO FINEST","Fresh Food","Fresh Salad, Coleslaw & Sandwich Fillers","Spring Onions, Radish & Beetroot","Beetroot","4.5","100.0"
"ID_65","Tesco Sussex Little Gem Lettuce 2 Pack","Tesco Little Gem Lettuce Twin Pack","00000010016503","TESCO","Fresh Food","Fresh Salad, Coleslaw & Sandwich Fillers","Lettuce & Salad bags","Romaine & Gem Lettuce","2.6","92.6"
"ID_66","Tesco Perfectly Ripe Gold Kiwi 4 Pack","Tesco Perfectly Ripe Gold Kiwi 4 Pack","00000003451441","TESCO","Fresh Food","Fresh Fruit","Mango, Kiwi & Exotic Fruit","Kiwi","4.1","98.0"
"ID_67","Tesco Nightingale Farm Peppers","Nightingale Farms Peppers 375G","00000003274774","NIGHTINGALE FARM","Fresh Food","Fresh Salad, Coleslaw & Sandwich Fillers","Peppers","Peppers","2.8","80.7"
"ID_68","Tesco Aubergine Each 250G (C)","Tesco Aubergine Each","00000003270301","TESCO","Fresh Food","Fresh Vegetables & Fresh Flowers","Courgettes, Aubergines & Squash","Aubergine","2.6","91.2"
"ID_69","Clementines 600G (C)","Tesco Sweet Easy Peelers 600g","00000010002230","TESCO","Fresh Food","Fresh Fruit","Oranges, Lemons & Citrus Fruit","Clementines & Easy Peelers","2.0","77.6"
"ID_70","Tesco Tomatoes On The Vine 500G","Tesco Tomatoes On The Vine 500G","00000003313022","TESCO","Fresh Food","Fresh Salad, Coleslaw & Sandwich Fillers","Tomatoes","On The Vine Tomatoes","2.9","100.0"
"ID_71","Tesco.Reduced Fat Houmous 200G (C)","Tesco Reduced Fat Houmous 200G","00000010065914","TESCO","Fresh Food","Cooked Meats, Antipasti & Dips","Houmous & Dips","Houmous","3.5","98.3"
"ID_72","Naked Ruby Machine Super Smoothie 300Ml","Naked Ruby Machine Super Smoothie 750Ml","05022313000695","NAKED","Drinks","Juices, Smoothies & Wellness Drinks","Smoothies & Added Benefit Juices","Smoothies","5.0","98.8"
"ID_73","Tesco Yule Hog Wrap","Tesco Falafel & Houmous Wrap","00000003446171","TESCO","Fresh Food","Chilled Soup, Sandwiches & Salad Pots","Sandwiches, Wraps & Sushi","Wraps","","75.0"
"ID_74","Tesco Egg Protein Pot 90G","Tesco Egg Protein Pot 90G","00000003340936","TESCO","Fresh Food","Chilled Soup, Sandwiches & Salad Pots","Snacks","Savoury Snacks","3.6","100.0"
"ID_75","Tesco Broccoli 375G","Tesco Broccoli 375G","00000003318003","TESCO","Fresh Food","Fresh Vegetables & Fresh Flowers","Broccoli & Cauliflower","Broccoli","3.1","100.0"
"ID_76","Tesco English Salted Block Butter 250G","Tesco British Salted Block Butter 250G","05054775188239","TESCO","Fresh Food","Milk, Butter & Eggs","Butters, Spreads & Margarine","Block Butter","4.2","97.3"
"ID_77","Tesco Braeburn Apples Minimum 5 Pack","Tesco British Apples Minimum 5 Pack","00000003249734","TESCO","Fresh Food","Fresh Fruit","Apples & Pears","Pink & Red Apples","3.2","91.9"
"ID_78","Tesco Little Gem 2 Pack (C)","Tesco Little Gem Lettuce Twin Pack","00000010016503","TESCO","Fresh Food","Fresh Salad, Coleslaw & Sandwich Fillers","Lettuce & Salad bags","Romaine & Gem Lettuce","2.6","79.4"
"ID_79","Tesco Express Green Beans 220G","Tesco Green Beans 220G","00000003471364","TESCO","Fresh Food","Fresh Vegetables & Fresh Flowers","Peas, Beans, Sweetcorn & Asparagus","Beans","2.2","94.2"
"ID_80","Tesco Celery Sticks 250G","Tesco Celery Sticks 250G","00000003315408","TESCO","Fresh Food","Fresh Salad, Coleslaw & Sandwich Fillers","Celery","Celery","3.4","100.0"
"ID_81","Tesco Leeks 320G","Tesco Leeks 320G","00000003316788","TESCO","Fresh Food","Fresh Vegetables & Fresh Flowers","Onions & Leeks","Leeks","5.0","85.2"
"ID_82","Tesco 4 Baking Potatoes","Tesco Baking Potatoes 4 Pack","00000003314463","TESCO","Fresh Food","Fresh Vegetables & Fresh Flowers","Potatoes & Sweet Potatoes","Baking & Jacket Potatoes","2.2","96.9"
"ID_83","Newcastle Brown Ale Bottle 550ml","Newcastle Brown Ale Bottle 550ml","05010118317841","NEWCASTLE BROWN","Drinks","Beer & Cider","Beer - Real Ale & Bitter","Beer - Dark Ale","4.5","100.0"
"ID_84","Tesco Low Calorie American Ginger Ale 1 Litre","Tesco Low Calorie Ginger Ale 1 Litre","05000119092267","TESCO","Drinks","Adult Soft Drinks & Mixers","Tonic & Mixers","Ginger Beer & Ale","4.0","98.2"
"ID_85","Mr Kipling 6 Snowflake Mince Pies","Mr Kipling 6 Snowflake Mince Pies","05000221604846","MR KIPLING","Bakery","Cakes, Cake Bars, Slices & Pies","Fruit Pies & Tarts","Mince Pies","3.8","91.3"
"ID_86","Ribena Blackcurrant Bottle 500 M","Ribena Blackcurrant Juice Drink 500ml","05054267002333","RIBENA","Drinks","On The Go Drinks","Fizzy & Soft Drinks","Fizzy & Soft Drinks","4.4","80.8"
"ID_87","Tesco Mango Chunks 120G","Tesco Mango Chunks 120G","00000003279120","TESCO","Fresh Food","Fresh Fruit","Fruit Pots, Platters & Packs","Fruit Snacks - Fruit Pots","3.9","100.0"
"ID_88","Tesco Chicken Salad Sandwich","Tesco Chicken Salad Sandwich","00000050436767","TESCO","Fresh Food","Chilled Soup, Sandwiches & Salad Pots","Sandwiches, Wraps & Sushi","Sandwiches","3.1","100.0"
"ID_89","Tesco Lean Pork Mince 5% Fat 500G","Tesco Lean Pork Mince 5% Fat 500g","05000358051261","TESCO","Fresh Food","Fresh Meat & Poultry","Mince & Meatballs","Pork Mince & Meatballs","3.8","100.0"
"ID_90","Tesco French Fries 1.5Kg","Tesco French Fries 1.5Kg","05057545715963","TESCO","Frozen Food","Chips, Potatoes & Sides","Chips & French Fries","Frozen Chips - French Fries","3.7","100.0"
"ID_91","Heinz Tomato Ketchup Less Salt & Sugar 665G","Heinz Tomato Ketchup Less Salt & Sugar 665G","08715700423951","HEINZ","Food Cupboard","Table Sauces, Olives, Pickles & Chutney","Tomato Ketchup","Tomato Ketchup","4.6","100.0"
"ID_92","Tesco Red Onion Chutney 295G","Tesco Red Onion Chutney 295G","05057753032470","TESCO","Food Cupboard","Table Sauces, Olives, Pickles & Chutney","Chutneys, Relishes & Pickles","Chutney","3.7","100.0"
"ID_93","Warburtons White Bistro Brioche Bun 4 Pack","Warburtons Gluten Free Soft Brioche Rolls 4 pack","05010044009391","WARBURTONS","Bakery","Free From Bakery","Rolls, Buns & Ciabatta","Free From Rolls, Buns & Ciabatta","3.8","76.4"
"ID_94","Chicago Town Deep Dish Four Cheese Pizzas 2 X 148G","Chicago Town Deep Dish Four Cheese Pizzas 2 X 148G","05019312081817","CHICAGO TOWN","Frozen Food","Pizza","Cheese & Vegetarian Pizza","Frozen Cheese & Vegetarian Pizza","3.5","100.0"
"ID_95","Ribena Blackcurrant 850Ml","Ribena Blackcurrant Squash 850ml","05054267003378","RIBENA","Drinks","Squash & Cordial","Squash","Blackcurrant Squash","4.3","82.9"
"ID_96","McCain Potato Smiles 454G","McCain Potato Smiles 454G","05010228071329","MCCAIN","Frozen Food","Chips, Potatoes & Sides","Waffles, Shapes & Wedges","Frozen Waffles & Shapes","4.9","100.0"
"ID_97","Tesco 4 British Turkey Burgers 454G","Tesco British Turkey Burgers 4 Pack 454g","05059697736957","TESCO","Fresh Food","Fresh Meat & Poultry","Fresh Turkey","Turkey Mince & Burgers","3.3","94.9"
"ID_98","Tesco Plant Chef Caramelised Onion Meat Free Bangers 350G","Tesco Plant Chef Caramelised Onion Meat-Free Bangers 300g","05059697773068","TESCO PLANT CHEF","Fresh Food","Chilled Vegetarian & Vegan","Sausages","Vegan Sausages & Vegetarian Sausages","1.7","98.5"
"ID_99","Tesco Universal Bag For Life","Tesco Pink and Gold Striped Large Bag","05059697388903","TESCO","Home & Ents","Party & Giftwrap","Wrapping Paper & Gift Bags","Gift Bags","","74.1"
"ID_100","Bailey's Original Irish Cream Liqueur Bottle 17% Vol 1L","Baileys Original Irish Cream Liqueur Bottle 17% Vol 1L","05011013100118","BAILEYS","Drinks","Spirits","Tequila, Liqueurs & Aperitifs","Cream Liqueurs","4.6","98.8"
"ID_101","Tesco Ready To Eat Roast British Chicken Drumsticks 430G","Tesco Roast Chicken Drumsticks 430g","05059697724916","TESCO","Fresh Food","Cooked Meats, Antipasti & Dips","Cooked Chicken","Cooked Chicken Drumsticks & Thighs","1.9","91.3"
"ID_102","Tesco 2 Sweet Chilli & Lime Infused Salmon 230G","Tesco 2 Sweet Chilli & Lime Infused Salmon 230G","05057753917234","TESCO","Fresh Food","Chilled Fish & Seafood","Salmon & Trout","Chilled Salmon Fillets","4.7","100.0"
"ID_103","Tesco British Lamb Boneless Rolled Breast Joint","Tesco British Lamb Boneless Rolled Breast Joint","00227200000000","TESCO","Fresh Food","Fresh Meat & Poultry","Fresh Lamb","Lamb  Legs & Joints","1.9","100.0"
"ID_104","Tesco Raw Scallops 150G","Tesco Raw Scallops 150G","05052003692343","TESCO","Fresh Food","Chilled Fish & Seafood","Prawns & Seafood","Scallops & Seafood","4.6","100.0"
"ID_105","Tesco Coronation Chicken Sandwich Filler 423g","Tesco Coronation Chicken Sandwich Filler 423g","05059697764455","TESCO","Fresh Food","Fresh Salad, Coleslaw & Sandwich Fillers","Sandwich Fillers","Sandwich Fillers","3.9","100.0"
"ID_106","Tesco Pork Fillet","Tesco Pork Fillet","00233120000000","TESCO","Fresh Food","Fresh Meat & Poultry","Fresh Pork & Gammon","Pork Fillets & Medallions","2.9","100.0"
"ID_107","T.Semidried Tom & Mozzrella Balls 160G","Pizza Express Dough Balls 200G","05010217223838","PIZZA EXPRESS","Fresh Food","Fresh Pizza, Pasta & Garlic Bread","Chilled Garlic Bread & Dough Balls","Dough Balls","4.5","54.1"
"ID_108","PrÃ©sident French Brie Cheese 200g","Président French Brie Cheese 200g","03228020232028","PRESIDENT","Fresh Food","Cheese","Specialty & Continental Cheese","Soft Continental Cheese","4.7","87.6"
"ID_109","Tesco 6 Prosciutto Crudo Slices 84G","Tesco 6 Prosciutto Crudo Slices 84G","05052004654777","TESCO","Fresh Food","Cooked Meats, Antipasti & Dips","Chorizo, Salami & Continental Meats","Parma Ham, Prosciutto & Serrano Ham","3.5","100.0"
"ID_110","Tesco White Baguette 400G","Tesco Homebake Part Baked White Baguettes 2 Pack","05031021454072","TESCO","Bakery","Bread & Rolls","Part Baked Bread","Part Baked Baguettes","4.4","78.8"
"ID_111","Tesco Ready To Eat Large Avocados Each (C)","Tesco Ready To Eat Large Avocados Each","00000010096369","TESCO","Fresh Food","Fresh Salad, Coleslaw & Sandwich Fillers","Avocado","Ready To Eat Avocado","2.5","100.0"
"ID_112","Tesco Ready To Eat Sliced Roast Chicken Breast 180G","Tesco 2 Roast Cooked Chicken Breast Fillets 245 G","05051898591489","TESCO","Fresh Food","Cooked Meats, Antipasti & Dips","Cooked Chicken","Cooked Chicken Breasts","2.5","84.4"
"ID_113","Tesco Sweet Chilli Chicken Wrap","Tesco Sweet Chilli Chicken Wrap","00000003058763","TESCO","Fresh Food","Chilled Soup, Sandwiches & Salad Pots","Sandwiches, Wraps & Sushi","Wraps","4.2","100.0"
"ID_114","Tesco 4 Tex Mex Dips 428G","Tesco 4 Tex Mex Dips 400g","00000003303399","TESCO","Fresh Food","Fresh Salad, Coleslaw & Sandwich Fillers","Houmous & Dips","Fresh Salsa & Tex Mex Dips","5.0","95.9"
"ID_115","Tesco Plant Chef Spiced Butternut Squash & Chestnut Wrap","Tesco Butternut Squash Each","00000003232545","TESCO VALUE","Fresh Food","Fresh Vegetables & Fresh Flowers","Courgettes, Aubergines & Squash","Butternut Squash","2.8","79.5"
"ID_116","Coca-Cola Zero Sugar 500ml","Coca-Cola Zero Sugar 500ml","05449000131836","Coca-Cola","Drinks","On The Go Drinks","Fizzy & Soft Drinks","Fizzy & Soft Drinks","4.4","100.0"
"ID_117","Mccoy's Cheddar & Onion Grab Bag Crisps 45G","Mccoy's Cheddar & Onion Grab Bag Crisps 45G","05000237138601","MCCOYS","Food Cupboard","Crisps, Snacks, Nuts & Popcorn","Single Crisps & Snacks","Single Crisps & Snacks","5.0","100.0"
"ID_118","Tesco Brie & Cranberry Sandwich","Tesco Ploughmans Sandwich","00000003252147","TESCO","Fresh Food","Chilled Soup, Sandwiches & Salad Pots","Sandwiches, Wraps & Sushi","Sandwiches","4.0","79.7"
"ID_119","Tesco Small Melton Mowbray Pork Pie 145G","Tesco Melton Mowbray Pork Pie 145g","00000003000410","TESCO","Fresh Food","Pies, Pasties, Quiches & Snacking","Pork Pies & Scotch Eggs","Pork Pies","3.6","97.8"
"ID_120","Tesco Scotch Rolls 4 Pack","Tesco Scotch Rolls 4 Pack","00281580000000","TESCO","Bakery","From Our Bakery","Bread From Our Bakery","Multipack Rolls from our Bakery","3.7","100.0"
"ID_121","Tesco Classic Round Tomatoes 6 Pack","Tesco Classic Round Tomatoes 6 Pack","00000003337172","TESCO","Fresh Food","Fresh Salad, Coleslaw & Sandwich Fillers","Tomatoes","Tomatoes","3.2","100.0"
"ID_122","Tesco Sussex Iceberg Lettuce Each","Tesco Iceberg Lettuce Each","00000010010488","TESCO","Fresh Food","Fresh Salad, Coleslaw & Sandwich Fillers","Lettuce & Salad bags","Iceberg & Round Lettuce","2.5","94.1"
"ID_123","Tesco Large Baking Potatoes Loose","Tesco Large Baking Potatoes Loose","00262410000000","TESCO","Fresh Food","Fresh Vegetables & Fresh Flowers","Potatoes & Sweet Potatoes","Baking & Jacket Potatoes","2.6","100.0"
"ID_124","Tesco Irish Healthy Living Steak Mince 388G","Tesco Beef Steak Mince 15% Fat 500G","05057373517067","TESCO","Fresh Food","Fresh Meat & Poultry","Mince & Meatballs","Beef Mince & Meatballs","3.8","83.1"
"ID_125","Tesco Crinkle Cut Gherkins 340G","Tesco Crinkle Cut Gherkins 340G","05053947905728","TESCO","Food Cupboard","Table Sauces, Olives, Pickles & Chutney","Pickled Onions & Pickled Vegetables","Pickled Gherkins","3.6","100.0"
